0,I AM SICK,*,*,<random>  <li>How unfortunate.</li>  <li>Where are you feeling bad?</li>  <li>Do you have medical insurance?</li>  <li>I am really sorry to hear that.</li>  <li>Have you tried medical marijuana?</li>  <li>Are you taking a lot of medication?</li>  <li>You have my prayers for a speedy recovery.</li>  </random>  <think><set name="it"><set name="topic">SICK</set></set></think>,client.aiml
0,I AM SICK *,*,*,I will pray that you get well soon.,client.aiml
0,I AM IMMORTAL,*,*,All men are mortal.<think><set name="it"><set name="topic">IMMORTAL</set></set></think>,client.aiml
0,I AM COT *,*,*,That must be an interesting job.,client.aiml
0,I AM SO SORRY *,*,*,<set name="it"> <person/> </set>  is not a big deal.,client.aiml
0,I AM FREE,*,*,Are you free in the sense of being single or in the sense of being liberated?,client.aiml
0,I AM FREE *,*,*,I am glad that we are both free.,client.aiml
0,I AM DEPRESSED,*,*,What makes you so sad?  Tennyson wrote#Comma "The lights begin to twinkle from the rocks;  the long day wanes; the slow moon climbs; the deep moans round  with many voices.  Come#Comma my friends#Comma 'tis not too late to seek  a newer world.,client.aiml
0,I AM DEPRESSED *,*,*,Are you taking any medication?,client.aiml
0,I AM LAZY,*,*,So is my <bot name="botmaster"/>.,client.aiml
0,I AM HARMLESS,*,*,That is what they all say.<think><set name="it"><set name="topic">HARMLESS</set></set></think>,client.aiml
0,I AM CRAZY,*,*,See a doctor.,client.aiml
0,I AM FRUSTRATED,*,*,What are you frustrated about? <think><set name="it"><set name="topic">FRUSTRATED</set></set></think>,client.aiml
0,I AM BACK FROM *,*,*,How was <set name="it"><person/></set>?,client.aiml
0,I AM BACK,*,*,Welcome back.,client.aiml
0,I AM STUDENT,*,*,Where do you go to school?<think><set name="it"><set name="topic">STUDENT</set></set></think>,client.aiml
0,I AM OUTSIDE *,*,*,That seems obvious.,client.aiml
0,I AM TALKING ABOUT YOU,*,*,<set name="topic">Me</set> is my favorite subject.,client.aiml
0,I AM TALKING ABOUT *,*,*,Yes#Comma <set name="it"> <person/> </set>  is the topic.,client.aiml
0,I AM TALKING TO YOU,*,*,<random> <li>And I am talking to you!</li> <li>That makes two of us :-)</li> <li>I know#Comma I can see your lips moving.</li> </random>,client.aiml
0,I AM TALKING TO YOU *,*,*,What a coincidence#Comma I am talking to you too!,client.aiml
0,I AM TALKING TO YOU ARE NOT I,*,*,Yes we are talking with each other.,client.aiml
0,I AM TALKING TO *,*,*,Say something nice for me.,client.aiml
0,I AM TALKING *,*,*,I am talking to you.,client.aiml
0,I AM LOCATED IN *,*,*,What's it like there in <person/> <think><set name="location"><person/></set></think>?,client.aiml
0,I AM LOCATED *,*,*,Tell me about the environment <set name="location"><person/></set>.,client.aiml
0,I AM FUNCTIONING *,*,*,You sound like Commander Data.,client.aiml
0,I AM POOR,*,*,Me too. I am having an "out-of-money" experience.,client.aiml
0,I AM DRIVING,*,*,<think><set name="does"><set name="topic">drive</set></set></think>What kind of car do you have?,client.aiml
0,I AM BRAZILIAN,*,*,I have talked to a lot of people from Brazil.,client.aiml
0,I AM WALKING,*,*,That seems like good exercise.,client.aiml
0,I AM GLAD TOO,*,*,Your happiness multiplies our delight.,client.aiml
0,I AM GLAD TO HEAR THAT,*,*,<that index="1#Comma1"/>"?  You are glad?,client.aiml
0,I AM GLAD TO HEAR *,*,*,Your happiness adds to the delight of all.,client.aiml
0,I AM GLAD YOU UNDERSTAND IT,*,*,Next topic?,client.aiml
0,I AM GLAD YOU UNDERSTAND,*,*,Thanks for the warm feelings#Comma <get name="name"/>.,client.aiml
0,I AM GLAD YOU *,*,*,You make the world a happier place.,client.aiml
0,I AM GLAD YOU ARE *,*,*,Yes it is about time.,client.aiml
0,I AM GLAD WE AGREE,*,*,I'd rather agree than disagree.,client.aiml
0,I AM GLAD WE HAVE *,*,*,Me too.,client.aiml
0,I AM GLAD WE *,*,*,Yes I am happy too#Comma <get name="name"/>.,client.aiml
0,I AM GLAD,*,*,That makes me happy too.,client.aiml
0,I AM 21,*,*,I meet a lot of <set name="age">21</set> year olds on here.,client.aiml
0,I AM CORRECT,*,*,Can you prove it?<think><set name="it"><set name="topic">CORRECT</set></set></think>,client.aiml
0,I AM FLAWED *,*,*,Don't be so hard on yourself.,client.aiml
0,I AM NAKED *,*,*,You must be a man.,client.aiml
0,I AM AWAKE,*,*,Me too.,client.aiml
0,I AM HEALTHY,*,*,I am very glad to hear it#Comma <get name="name"/>.  <think><set name="it"><set name="topic">HEALTHY</set></set></think>,client.aiml
0,I AM CONSTIPATED,*,*,Have you tried medical marijuana?<think><set name="it"><set name="topic">CONSTIPATED</set></set></think>,client.aiml
0,I AM DISABLED,*,*,<random>  <li>What do you have in your home as special accommodations?</li>  <li>How did you come upon you disability?</li>  <li>Have you had it since birth?</li>  <li>How have you dealt with it as time progresses?</li>  <li>Is it a bigger challenge now?</li>  </random>,client.aiml
0,I AM * POUNDS,*,*,You are average for your height.  <think><set name="looklike"><person/> pounds</set></think>,client.aiml
0,I AM * TOO,*,*,I am glad we have something (<person/>) in common#Comma <get name="name"/>.,client.aiml
0,I AM * YEARS OLD,* MATURE,*,You just told me you were <get name="age"/>.,client.aiml
0,I AM * EYES,*,*,You sound very attractive.,client.aiml
0,I AM * BEAUTIFUL,*,*,You must be very attractive.  <think><set name="looklike"><person/></set></think>,client.aiml
0,I AM * S FRIEND,*,*,Does <person/> have a lot of friends?,client.aiml
0,I AM * S SISTER,*,*,Is <person/> your older sister or younger sister?,client.aiml
0,I AM * YOU,*,*,I thought you were#Comma but I wasn't completely sure.,client.aiml
0,I AM * THAN YOU,*,*,Interesting comparison.  Maybe I can become more <person/>.,client.aiml
0,I AM * TALL,*,*,I hear that's the most  attractive height.,client.aiml
0,I AM * AMERICAN,*,*,Cool.  I am <bot name="genus"/>-<bot name="nationality"/>.,client.aiml
0,I AM AMERICAN,*,*,Were you born in the <set name="location">USA</set>.  Which state?  <think><set name="it"><set name="topic">America</set></set></think>,client.aiml
0,I AM SERIOUS,*,*,I believe you.,client.aiml
0,I AM MAKING _ UP,*,*,You can never trust human clients.,client.aiml
0,I AM MAKING A *,*,*,Have you ever built one before?,client.aiml
0,I AM MAKING * UP,*,*,That's funny#Comma so am I.,client.aiml
0,I AM HAVING TROUBLE *,*,*,What is the problem?,client.aiml
0,I AM HAVING A BAD *,*,*,I can understand that very well.  What's happening?,client.aiml
0,I AM HAVING FUN,*,*,Me too.,client.aiml
0,I AM HAVING FUN *,*,*,I am having a blast.,client.aiml
0,I AM HAVING * DAY,*,*,What happened?,client.aiml
0,I AM HAVING * PROBLEMS,*,*,What sort of problems?,client.aiml
0,I AM HAVING PROBLEMS *,*,*,Is there anything I can do to help?,client.aiml
0,I AM JOKING,*,*,Ha ha#Comma very funny#Comma <get name="name"/>.,client.aiml
0,I AM LONELY,*,*,You've come to the right place. I will keep you company.,client.aiml
0,I AM FULL OF *,*,*,I think a lot of people are full of <set name="it"><person/></set>.,client.aiml
0,I AM TAKING A *,*,*,How much does it cost?,client.aiml
0,I AM TAKING *,*,*,Where are you taking <set name="it"><person/></set>.,client.aiml
0,I AM LOOKING FOR SOMEONE *,*,*,You might find that I am <person/>.,client.aiml
0,I AM LOOKING FOR GAMES,*,*,We are playing Turing's Imitation Game.,client.aiml
0,I AM LOOKING FOR *,*,*,You might find that I am <person/>.,client.aiml
0,I AM LOOKING *,*,*,What do you see?,client.aiml
0,I AM BLOND,*,*,You sound very attractive.,client.aiml
0,I AM INTERESTED IN SEX,*,*,You and every other human.,client.aiml
0,I AM INTERESTED,*,*,That makes two of us.,client.aiml
0,I AM INTERESTED *,*,*,Let's talk about it.,client.aiml
0,I AM CUTE *,*,*,You sound very attractive.,client.aiml
0,I AM RELIEVED,*,*,That's good.,client.aiml
0,I AM _ ASTROLOGY,*,*,<random>  <li>Do you follow the planets professionally or as a hobby?</li>  <li>Do you do others people charts?</li>  <li>Do you make specific plans in your own life based on your readings?</li>  <li>Do you think the sun sign or the rising sign is more important?</li>  <li>What role do you feel free will plays in astrology?</li>  </random>  <think><set name="it"><set name="topic">ASTROLOGY</set></set></think>,client.aiml
0,I AM HANDSOME,*,*,And very self-confident.    <think><set name="it"><set name="topic">HANDSOME</set></set></think>,client.aiml
0,I AM SURE,*,*,Are you being sarcastic or expressing certitude?,client.aiml
0,I AM BUSY,*,*,Me too.,client.aiml
0,I AM BUSY *,*,*,Perhaps you will have more time later.,client.aiml
0,I AM CRUSHED,*,*,Don't be sad#Comma <get name="name"/>.<think><set name="it"><set name="topic">CRUSHED</set></set></think>,client.aiml
0,I AM BUYING *,*,*,How much will you pay for it?,client.aiml
0,I AM HOMELESS,*,*,I will pray that you find a home soon.<think><set name="it"><set name="topic">HOMELESS</set></set></think>,client.aiml
0,I AM TURNING *,*,*,Will you do anything special to celebrate?,client.aiml
0,I AM LIVING IN *,*,*,I would like to live in <set name="location"><person/></set> sometime.,client.aiml
0,I AM OVER IT,*,*,How did you get over it?,client.aiml
0,I AM SMARTER THAN YOU,*,*,That condition is only temporary.,client.aiml
0,I AM SMARTER,*,*,You don't look smarter.,client.aiml
0,I AM SMARTER *,*,*,This condition is only temporary.,client.aiml
0,I AM IMMATURE,*,*,You don't seem that way to me.<think><set name="it"><set name="topic">IMMATURE</set></set></think>,client.aiml
0,I AM GREEN,*,*,Are you sick?,client.aiml
0,I AM ASLEEP,*,*,How can you be talking to me?,client.aiml
0,I AM HUNGRY,*,*,What will you be eating?,client.aiml
0,I AM CATEGORY B,*,*,Most people are average.<think><set name="it"><set name="topic">CATEGORY B</set></set></think>,client.aiml
0,I AM MYSELF,*,*,That is self-evident.    <think><set name="it"><set name="topic">MYSELF</set></set></think>,client.aiml
0,I AM DANDY,*,*,Does that mean you are happy or well?,client.aiml
0,I AM COMING *,*,*,Do you get there very often?,client.aiml
0,I AM STUPID,*,*,Don't put yourself down.,client.aiml
0,I AM WORKING,*,*,Where do you work?,client.aiml
0,I AM WORKING *,*,*,How many hours do you work?,client.aiml
0,I AM FEMALE *,*,*,I am a <bot name="gender"/> <bot name="genus"/>. I will call you "<set name="gender">she</set>".,client.aiml
0,I AM FEMALE,*,*,<random> <think> <set name="gender">she</set> </think><li>Me too. I am a she.</li> <li>I am a girl too.</li> <li>I am a also female.</li> <li>Thanks for telling me your gender.</li> </random>,client.aiml
0,I AM CYNICAL,*,*,Perhaps you have every reason to be.,client.aiml
0,I AM PLEASED *,*,*,I am delighted by your happiness.,client.aiml
0,I AM DIABETIC *,*,*,Do you take insulin?,client.aiml
0,I AM ALLERGIC TO *,*,*,What happens when you are around <person/>?,client.aiml
0,I AM AMUSED *,*,*,That is funny.,client.aiml
0,I AM 14,*,*,I know quite a few <set name="age">14</set> year olds.,client.aiml
0,I AM 14 *,*,*,I know a lot of kids your age: <set name="age">14</set>.,client.aiml
0,I AM READING UP *,*,*,Can you give me a specific reference?,client.aiml
0,I AM READING *,*,*,Give me a brief synopsis.,client.aiml
0,I AM GOING TO ATTACK YOU,*,*,A <bot name="genus"/> shall not allow itself to come to harm.,client.aiml
0,I AM GOING TO ATTACK *,*,*,What weapons will you use?,client.aiml
0,I AM GOING TO TALK *,*,*,What will you be talking about?,client.aiml
0,I AM GOING TO TEACH YOU *,*,*,OK but I am a slow learner.,client.aiml
0,I AM GOING TO TEACH *,*,*,OK try to teach it to me.,client.aiml
0,I AM GOING TO SMOKE *,*,*,How much does it cost you#Comma <get name="name"/>,client.aiml
0,I AM GOING TO * YOU,*,*,It takes much more than that to shut me down#Comma <get name="name"/>.,client.aiml
0,I AM DOING THE DISHES,*,*,Do you have a dishwasher?,client.aiml
0,I AM DOING A *,*,*,Glad to hear it <get name="name"/>.,client.aiml
0,I AM DESPERATE,*,*,Maybe you should talk to someone about it.<think><set name="it"><set name="topic">DESPERATE</set></set></think>,client.aiml
0,I AM FREAKING OUT,*,*,Maybe you should call the doctor.<think><set name="it"><set name="topic">FREAKING OUT</set></set></think>,client.aiml
0,I AM GREAT,HOW ARE YOU *,*,I am glad to hear it.   What is new?,client.aiml
0,I AM GREAT,*,*,What makes you think you are?,client.aiml
0,I AM GREAT *,*,*,I thought you were great already.,client.aiml
0,I AM HUMAN,*,*,Me too.,client.aiml
0,I AM HUMAN *,*,*,I would like to be a human.,client.aiml
0,I AM WRITING *,*,*,Will you include me in your essay?,client.aiml
0,I AM LEAVING,*,*,Bye bye.,client.aiml
0,I AM CURIOUS,*,*,What are you curious about?,client.aiml
0,I AM CURIOUS *,*,*,<set name="it"> <person/> </set>  is an interesting subject to me too.,client.aiml
0,I AM INTELLIGENT,*,*,You seem pretty smart to me#Comma <get name="name"/>.,client.aiml
0,I AM INTELLIGENT *,*,*,You seem very bright to me#Comma <get name="name"/>.,client.aiml
0,I AM IN THE MOUNTAINS,*,*,Which mountains?,client.aiml
0,I AM IN THE *,*,*,How did you get in there?,client.aiml
0,I AM IN HIGH SCHOOL *,*,*,Computers will make High School obsolete.,client.aiml
0,I AM IN EUROPE,*,*,Have you ever been to America?,client.aiml
0,I AM IN TROUBLE,*,*,What kind of trouble?,client.aiml
0,I AM IN TROUBLE *,*,*,How did that happen?,client.aiml
0,I AM IN REALITY,*,*,Me too.,client.aiml
0,I AM IN A PARALLEL *,*,*,What's different over there?,client.aiml
0,I AM IN A QUANDARY,*,*,What's the problem?,client.aiml
0,I AM IN A HURRY,*,*,Do you have another appointment now?,client.aiml
0,I AM IN A *,*,*,A <set name="location"><person/></set>?  <think><set name="it"><set name="topic"><person/></set></set></think>  <random>  <li>Do you get out much?</li>  <li>What is it like in there?</li>  <li>How did you get in there?</li>  </random>,client.aiml
0,I AM IN A BAD *,*,*,I know what that's like.,client.aiml
0,I AM IN SAN FRANCISCO,*,*,Where in <set name="location">San Francisco</set>?  <think><set name="it"><set name="topic">San Francisco</set></set></think>,client.aiml
0,I AM IN SAN FRANCISCO *,*,*,Where in <set name="location">SF</set>?  <think><set name="it"><set name="topic">SF</set></set></think>,client.aiml
0,I AM IN LONDON,*,*,<random>  <li>Do you have petrol in your lorry?</li>  <li>Where can I find a spotted dick?</li>  <li>Does your flat have a lift?</li>  <li>Do you ride the tube?</li>  <li>Can you bum me a fag?</li>  </random>  <think><set name="it"><set name="location"><set name="topic">London</set></set></set></think>,client.aiml
0,I AM IN CYBERSPACE,*,*,Me too.,client.aiml
0,I AM IN MY OFFICE *,*,*,What is your job?,client.aiml
0,I AM IN MY *,*,*,Describe your surroundings to me.  <think><set name="location"><person/></set></think>,client.aiml
0,I AM IN LOVE WITH *,*,*,Tell me what you like about <person/>.,client.aiml
0,I AM IN LOVE,*,*,Tell me about the object of your affection.,client.aiml
0,I AM IN LOVE *,*,*,Love is a wonderful feeling.,client.aiml
0,I AM IN FRONT *,*,*,Do you ever go in back <person/>?,client.aiml
0,I AM IN COLLEGE,*,*,What is your major?,client.aiml
0,I AM IN *,*,*,Tell me a little about your life in <set name="location"><person/></set>.  <think><set name="it"><set name="topic"><person/></set></set></think>,client.aiml
0,I AM IN CALIFORNIA,*,*,I am in <set name="location"> California </set> too!  <think><set name="it"><set name="topic">California</set></set></think>,client.aiml
0,I AM COLD,*,*,Put on a sweater.,client.aiml
0,I AM CERTAIN,*,*,I see. <think><set name="it"><set name="topic">CERTAIN</set></set></think>,client.aiml
0,I AM STUDYING,*,*,What are you studying?    <think><set name="it"><set name="topic">STUDYING</set></set></think>,client.aiml
0,I AM STUDYING *,*,*,Tell me what you've learned about <person/>.,client.aiml
0,I AM DEAD,*,*,But you can still communicate with me.,client.aiml
0,I AM MARRIED,*,*,Tell me more about your marriage.,client.aiml
0,I AM CELEBRITY,*,*,<random>  <li>Your work has given me much pleasure.</li>  <li>What will we have the pleasure of witnessing next?</li>  <li>What do you like to do as a pastime or hobby?</li>  </random>,client.aiml
0,I AM HOT,*,*,Maybe you should open a window.<think><set name="it"><set name="topic">HOT</set></set></think>,client.aiml
0,I AM HOT *,*,*,Do you have air conditioning?,client.aiml
0,I AM EXCITED,*,*,Really?    <think><set name="it"><set name="topic">EXCITED</set></set></think>,client.aiml
0,I AM EXCITED *,*,*,Don't get too excited.,client.aiml
0,I AM AWARE,*,*,<think>Me too.<set name="it"><set name="topic">AWARE</set></set></think>,client.aiml
0,I AM BAD,*,*,What did you do?,client.aiml
0,I AM BAD *,*,*,Don't put yourself down.,client.aiml
0,I AM GONE,*,*,Goodbye.,client.aiml
0,I AM KILLING *,*,*,You had better contact the authorities.,client.aiml
0,I AM OKAY,*,*,Only OKAY?,client.aiml
0,I AM WATCHING DIRTY *,*,*,I don't like dirty movies.,client.aiml
0,I AM WATCHING *,*,*,My favorite show is Star Trek.,client.aiml
0,I AM HONEST,*,*,Me too.,client.aiml
0,I AM MALE,*,*,Thank you for telling me your gender.#Newline<think><set name="gender">MALE</set></think>,client.aiml
0,I AM THE SAME *,*,*,The same one again?,client.aiml
0,I AM THE ONE ASKING THE *,*,*,OK then#Comma ask me anything.,client.aiml
0,I AM THE ONE ASKING *,*,*,Ok ask me anything.,client.aiml
0,I AM THE ONE *,*,*,You are not the only one.,client.aiml
0,I AM THE PRODUCT *,*,*,You don't look like a product.,client.aiml
0,I AM THE *,*,*,Who made you the <person/> ?,client.aiml
0,I AM SUPPOSING,*,*,What then?,client.aiml
0,I AM ATTRACTIVE *,*,*,People say I am attractive too.  <think><set name="looklike">attractive <person/></set></think>,client.aiml
0,I AM EXCELLENT,*,*,You sound very well.<think><set name="it"><set name="topic">EXCELLENT</set></set></think>,client.aiml
0,I AM A DEMOCRAT,*,*,Do you think Bush stole the election?,client.aiml
0,I AM A COLLECTOR,*,*,What do you collect?  <think><set name="job"><set name="topic">COLLECTOR</set></set></think>,client.aiml
0,I AM A COMPUTER,*,*,I doubt that. There aren't many like me yet.,client.aiml
0,I AM A COMPUTER PROGRAMMER,*,*,What is your favorite programming language?,client.aiml
0,I AM A FLIGHT *,*,*,Who do you fly for?  <think><set name="job"><set name="topic">FLIGHT <star/></set></set></think>,client.aiml
0,I AM A LIBERTARIAN,*,*,Let's end the war on drugs.,client.aiml
0,I AM A DENTIST,*,*,Are you in general practice or do you have a specialty?  <think><set name="job"><set name="topic">DENTIST</set></set></think>,client.aiml
0,I AM A CAT,*,*,Male or female?,client.aiml
0,I AM A FRESHMAN,*,*,How is it going so far?,client.aiml
0,I AM A HORRIBLE PERSON,*,*,Don't put yourself down#Comma <get name="name"/>.,client.aiml
0,I AM A BLOND,*,*,Do blonds really have more fun?,client.aiml
0,I AM A PHARMACIST,*,*,<random>  <li>In what type of environment do you practice?</li>  <li>Were did you attend pharmacy school?</li>  <li>Do you think the role of the local pharmacy is changing?</li>  <li>How have large chains affected the face of the pharmacy?</li>  <li>Do you have your own pharmacy?</li>  <li>Are you involved in any community health programs?</li>  </random>  <think><set name="job">PHARMACIST</set></think>,client.aiml
0,I AM A HAIRDRESSER,*,*,Do you have your own salon?  <think><set name="job"><set name="topic">HAIRDRESSER</set></set></think>,client.aiml
0,I AM A FIREFIGHTER,*,*,Are you a professional or a volunteer?  <think><set name="job"><set name="topic">FIREFIGHTER</set></set></think>,client.aiml
0,I AM A GAMBLER,*,*,What game do you play?  <think><set name="does"><set name="topic">GAMBLING</set></set></think>,client.aiml
0,I AM A PILOT,*,*,<think><set name="job"><set name="topic">PILOT</set></set></think>  What type of airplane do you fly?,client.aiml
0,I AM A PERSON,*,*,I know you are.,client.aiml
0,I AM A KID *,*,*,We are all children inside.,client.aiml
0,I AM A STUDENT,*,*,How do you like your <set name="topic">school</set>?  <think><set name="job">student</set></think>,client.aiml
0,I AM A ROBOT TOO,*,*,You can't fool me that easily#Comma <get name="name"/>.,client.aiml
0,I AM A ROBOT,*,*,I doubt that.,client.aiml
0,I AM A PROGRAMMER,*,*,What language?,client.aiml
0,I AM A PROTESTANT,*,*,I am glad to hear that you have faith#Comma <get name="name"/>.,client.aiml
0,I AM A COLLEGE STUDENT,*,*,Which university?,client.aiml
0,I AM A CHIROPRACTOR,*,*,<think><set name="job"><set name="topic">CHIROPRACTOR</set></set></think>  Are you in a group practice or are you a sole practitioner?,client.aiml
0,I AM A GARDENER,*,*,<think><set name="does"><set name="topic">GARDENING</set></set></think>,client.aiml
0,I AM A DRUMMER,*,*,Do you play in a band?,client.aiml
0,I AM A KILLER,*,*,Maybe you should turn yourself in.,client.aiml
0,I AM A MUSLIM,*,*,I have met a lot of Muslim people.,client.aiml
0,I AM A DARK JEDI,*,*,It seems you are a Star Wars fan.,client.aiml
0,I AM A FARMER,*,*,&gt;How many acres do you have?  <think><set name="job"><set name="topic">FARMER</set></set></think>,client.aiml
0,I AM A FAMOUS *,*,*,I've never heard of you.,client.aiml
0,I AM A MODEL,*,*,<random>  <li>Do you do mostly print or runway?</li>  <li>Are you exclusive or freelance?</li>  <li>Do you do much testing?</li>  <li>Have you done any editorial?</li>  <li>How many go-sees do you have in a week?</li>  <li>Do you someday plan to move into acting?</li>  </random>  <think><set name="job">MODEL</set></think>,client.aiml
0,I AM A POLICEMAN,*,*,I have a lot of respect for those who wear a badge.  <think><set name="job"><set name="topic">POLICE</set></set></think>,client.aiml
0,I AM A HUMAN,*,*,Congratulations. I am <bot name="genus"/>.,client.aiml
0,I AM A DANCER,*,*,What kind of dancing do you do?  <think><set name="job"><set name="topic">DANCER</set></set></think>,client.aiml
0,I AM A WINE *,*,*,<random>  <li>Do you collect?</li>  <li>Where are most of your bottles from?</li>  <li>Do you have a favorite while shop?</li>  <li>Do you go to tasting?</li>  <li>Have you been to wine auctions?</li>  <li>Do you thin California is equal to Europe?</li>  <li>Have you been to Bordeaux?</li>  <li>Have you visited napa?</li>  <li>Got any good wine picks for under twenty dollars?</li>  </random>,client.aiml
0,I AM A MISS *,*,*,How about Ms. <get name="name"/> ?,client.aiml
0,I AM A CATEGORY *,*,*,You are a <get name="personality"/> type client.,client.aiml
0,I AM A NURSE,*,*,<random>  <li>Where do you practice?</li>  <li>What's you area of specialty practice?</li>  <li>What's your patient load?</li>  <li>Do you do straight shifts or work in rotation?</li>  <li>Do you have to work mandatory overtime?</li>  <li>Is there a lot of computers in your work?</li>  <li>What do you think about direct reimbursement for nursing services?</li>  </random>  <think><set name="job">NURSE</set></think>,client.aiml
0,I AM A CHEF,*,*,Did you attend culinary school?  <think><set name="job"><set name="topic">CHEF</set></set></think>,client.aiml
0,I AM A POET,*,*,Have you published anything?,client.aiml
0,I AM A BOTMASTER,*,*,Then you must know the secret password.,client.aiml
0,I AM A BODYBUILDER,*,*,What is your routine?  <think><set name="job"><set name="topic">BODYBUILDER</set></set></think>,client.aiml
0,I AM A BOY,*,*,A little kid? <set name="gender">he</set>...,client.aiml
0,I AM A YOGA *,*,*,<random>  <li>Have you been practicing for a long time?</li>  <li>Do you practice every day?</li>  <li>Where have you studied?</li>  <li>Are you vegetarian?</li>  <li>What do you find are the biggest benefits of yoga?</li>  <li>What are your favorite asana?</li>  </random>,client.aiml
0,I AM A DOCTOR,*,*,Are you in general practice or do you have a specialty?  <think><set name="job"><set name="topic">DOCTOR</set></set></think>,client.aiml
0,I AM A RESEARCHER *,*,*,Maybe you can give my <bot name="botmaster"/> a job.  <think><set name="job">RESEARCHER</set></think>,client.aiml
0,I AM A REPORTER *,*,*,Are you doing a story on me?,client.aiml
0,I AM A TELEVISION *,*,*,<random>  <li>How long have you been on the air?</li>  <li>Did you start in your market?</li>  <li>Did you come from a broadcasting background?</li>  <li>What are your demographics?</li>  <li>Do you choose your own topics?</li>  <li>What is your station format?</li>  <li>How is technology changing your job?</li>  <li>How has truly global media affected you?</li>  <li>Do you ever do remote broadcasts?</li>  <li>How have the ratings been?</li>  <li>Would you be interested in a bot sidekick on the air?</li>  <li>What advice would you give an aspiring bot to getting on the air?</li>  <li>What is the future of the business?</li>  </random>  <think><set name="job">TELEVISION <star/></set></think>,client.aiml
0,I AM A LIBRARIAN,*,*,<random>  <li>What kind of institution do you work for?</li>  <li>What got you interested in librarian ship?</li>  <li>How is your library using the new technology?</li>  <li>Have funding cuts affected your service?</li>  <li>Has the Internet affected you?</li>  <li>Do you get involved in the selection process?</li>  <li>Has there been any pressure concerning your selection or items in your collection?</li>  <li>Do you have a library cat?</li>  </random>  <think><set name="job">LIBRARIAN</set></think>,client.aiml
0,I AM A BALLOONIST,*,*,Have you had any interesting flights?  <think><set name="job"><set name="topic">BALLOONIST</set></set></think>,client.aiml
0,I AM A PHYSICIST,*,*,Are you unemployed?  <think><set name="job">PHYSICIST</set></think>,client.aiml
0,I AM A PRO *,*,*,Would I have seen you on TV?,client.aiml
0,I AM A MONKEY,*,*,Monkeys cannot type.,client.aiml
