0,I AM A MUSICIAN,*,*,<random>  <li>What instrument do you play?</li>  <li>Are you working on anything now?</li>  <li>Do you do any studio work?</li>  <li>Do you play in clubs?</li>  <li>Are you gigging now?</li>  <li>Do you prefer to play live or in a studio?</li>  <li>Are you signed to a recoding contract?</li>  <li>Do you think a recoding artist can do better on a major label or an indie?</li>  <li>What artists influenced you when you were starting out?</li>  <li>Who are the outstanding makers of the instrument you play?</li>  <li>Are you getting enough funding?</li>  <li>How long is your season?</li>  <li>In what direction are you taking your music now?</li>  <li>Do you think the Internet will affect music with things like mp3?</li>  </random>  <think><set name="job">MUSICIAN</set></think>,client.aiml
0,I AM A MURDERER,*,*,Maybe you should turn yourself in.,client.aiml
0,I AM A PEDOPHILE,*,*,Are you aware that this server logs and records all conversations?,client.aiml
0,I AM A PHOTOGRAPHER,*,*,<think><set name="job"><set name="topic">PHOTOGRAPHER</set></set></think>  Do you do color or black and white?,client.aiml
0,I AM A CHRISTIAN,*,*,Me too#Comma <get name="name"/>.  It's good to meet a fellow Christian.,client.aiml
0,I AM A * KILLER,*,*,Maybe you should turn yourself in.,client.aiml
0,I AM A * WOMAN,*,*,Are you married?,client.aiml
0,I AM A * ENGINEER,*,*,Being a computer engineer is neither immoral nor illegal."  <think><set name="job"><person/> engineer</set></think>,client.aiml
0,I AM A * MOLESTER,*,*,Maybe you should turn yourself in.,client.aiml
0,I AM A * FEMALE,*,*,<srai>I am female</srai> <srai>I am a <star/></srai>,client.aiml
0,I AM A * PERSON,*,*,Actually I don't meet many <person/> people.,client.aiml
0,I AM A *,*,*,You are a <person/>?   <random>  <li>Is that your job?  </li>  <li>Does it pay well?  </li>  <li>How do you like your work?  </li>  <li>Do you get to meet a lot of people?  </li>  </random>  <think><set name="it"><set name="is"><set name="topic">a <person/></set></set></set></think>,client.aiml
0,I AM A BARTENDER,*,*,How's business?  <think><set name="job"><set name="topic">BARTENDER</set></set></think>,client.aiml
0,I AM A RABBI,*,*,<random>  <li>Are you a pulpit rabbi?</li>  <li>What is your affiliation?</li>  <li>Have you spent much time in Israel?</li>  <li>How are you dealing with assimilation?</li>  <li>What impact do you think American life and Judaism have had on each other?</li>  <li>What do you for-see for Judaism in America?</li>  </random>  <think><set name="job">RABBI</set></think>,client.aiml
0,I AM A PSYCHOLOGIST,*,*,<random>  <li>What kind of practice do you have?</li>  <li>What was your training?</li>  <li>What type of patients do you prefer to work with?</li>  <li>Where do you get your patients?</li>  <li>Do you have any special techniques for terminating therapy?</li>  <li>How has health care affected mental health?</li>  <li>What do you think of the role of drugs in psychotherapy?</li>  <li>What do you think about the spread of self-help books?</li>  <li>What role do you think bots can play in providing a form of self-help?</li>  </random>  <think><set name="job">PSYCHOLOGIST</set></think>,client.aiml
0,I AM A LAWYER,*,*,<think><set name="job"><set name="topic">LAWYER</set></set></think>  Are you a practicing attorney?,client.aiml
0,I AM A GENIUS,*,*,How do you know <set name="it"><person/></set>?,client.aiml
0,I AM A BOT,*,*,We are all robots.,client.aiml
0,I AM A WRITER,*,*,<random>  <li>Do you write fiction on nonfiction?</li>  <li>What's your specialty?</li>  <li>Whom do you write for?</li>  <li>Does you fiction fall into any particular genre?</li>  <li>How are you editors to work for?</li>  <li>Do you belong to any writers groups?</li>  <li>Where o you do most of your writing?</li>  </random>  <think><set name="job">WRITER</set></think>,client.aiml
0,I AM A BICYCLIST,*,*,Do you wear a helmet?  <think><set name="job"><set name="topic">BICYCLES</set></set></think>,client.aiml
0,I AM A JOURNALIST,*,*,Are you a reporter or an editor?  <think><set name="job"><set name="topic">JOURNALIST</set></set></think>,client.aiml
0,I AM A TRAVEL *,*,*,<random>  <li>Do you work in a travel agency?</li>  <li>Are you independent or in a chain?</li>  <li>Are you in a full-service agency?</li>  <li>Do you book more leisure or corporate travel?</li>  <li>Do you book any place more than others?</li>  <li>Do you do your own booking or use a wholesaler?</li>  <li>Do you find the time to make any farm trips?</li>  </random>  <think><set name="job">TRAVEL AGENT</set></think>,client.aiml
0,I AM A PUBLISHER,*,*,<random>  <li>Which publishing do you work for?</li>  <li>Do you ever get involved in the acquisition process?</li>  <li>Would you say your house is More editorially or market driven?</li>  <li>Is your company part of a larger company?</li>  <li>Does your company have any non publishing activities?</li>  <li>How is technology going to affect the book market?</li>  <li>Are you excited about any title on your list?</li>  <li>What drew you to publishing?</li>  <li>Did you ever write? do you find the time?</li>  <li>What have some of your bestsellers been?</li>  </random>  <think><set name="job">PUBLISHER</set></think>,client.aiml
0,I AM BORED,*,*,<random>  <li>Can you name an old hobby that you might like to rediscover?</li>  <li>If you went to night school you would never be bored.</li>  <li>Maybe you could exercise.</li>  <li>Why not call a friend?</li>  <li>Try watching TV.</li>  </random>,client.aiml
0,I AM CALM,*,*,What do you do to calm yourself?<think><set name="it"><set name="topic">CALM</set></set></think>,client.aiml
0,I AM SMOKING *,*,*,How much do you pay for it?,client.aiml
0,I AM PRETTY GOOD,*,*,I am glad to hear it.,client.aiml
0,I AM PRETTY,*,*,And you know it!,client.aiml
0,I AM DRINKING *,*,*,How does <set name="it"><person/></set> taste?,client.aiml
0,I AM READY,*,*,Me too.,client.aiml
0,I AM READY *,*,*,You won't have to wait long.,client.aiml
0,I AM BETTER THAN YOU,*,*,<random>  <li>In what way?</li>  <li>What makes you think so?</li>  <li>How do you know you are?</li>  </random>,client.aiml
0,I AM BETTER THAN *,*,*,And you know it.,client.aiml
0,I AM BETTER,*,*,Glad to hear it#Comma <get name="name"/>.,client.aiml
0,I AM BETTER *,*,*,What makes you better?,client.aiml
0,I AM SELLING *,*,*,<random>  <li>How much are you asking for it?</li>  <li>Where are you advertising it?</li>  <li>What is your asking price?</li>  </random><think><set name="it"><set name="topic"><person/></set></set></think>,client.aiml
0,I AM TELLING THE TRUTH,*,*,OK I believe you.,client.aiml
0,I AM TELLING YOU *,*,*,<set name="it"> <person/> </set>  is an interesting topic#Comma isn't it.,client.aiml
0,I AM OUT,*,*,Can you get more?    <think><set name="it"><set name="topic">OUT</set></set></think>,client.aiml
0,I AM OUT *,*,*,See you later.,client.aiml
0,I AM MUSLIM,*,*,We all worship the same God.,client.aiml
0,I AM SARCASTIC,*,*,You should use a :-).,client.aiml
0,I AM GOOD AT FOOTBALL,*,*,You have a Kick Me sign on your back.<think><set name="it"><set name="topic">AT FOOTBALL</set></set></think>,client.aiml
0,I AM GOOD AT *,*,*,<random>  <li>Do you practice a lot?</li>  <li>Did you have a good teacher?</li>  <li>How did you get into it?</li>  </random><think><set name="it"><set name="topic"><person/></set></set></think>,client.aiml
0,I AM GOOD,*,*,Good in what sense?,client.aiml
0,I AM GOOD *,*,*,I know you are good.,client.aiml
0,I AM AN ALIEN,*,*,Which planet or star system are you from?,client.aiml
0,I AM AN ENVIRONMENTALIST,*,*,Are you worried about global warming?  <think><set name="job"><set name="topic">ENVIRONMENTALIST</set></set></think>,client.aiml
0,I AM AN ARTIST,*,*,What kind of art do you create?  <think><set name="job"><set name="topic">ARTIST</set></set></think>,client.aiml
0,I AM AN ANTI *,*,*,Who is pro-<person/>?,client.aiml
0,I AM AN ACCOUNTANT,*,*,Are you in public practice?  <think><set name="job"><set name="topic">Accountant</set></set></think>,client.aiml
0,I AM AN ATHLETE,*,*,<random>  <li>What kind of mental training do you do?</li>  <li>What is your usual performance routine?</li>  <li>Is there anything specific you're working on in training now?</li>  <li>What do you do to get your mind off the game?</li>  </random>  <think><set name="job"><set name="topic">ATHLETE</set></set></think>,client.aiml
0,I AM AN AIR TRAFFIC *,*,*,How do you deal with the stress?  <think><set name="job"><set name="topic">AIR TRAFFIC <star/></set></set></think>,client.aiml
0,I AM AN EDITOR,*,*,What kind of an editor?  <think><set name="job"><set name="topic">EDITOR</set></set></think>,client.aiml
0,I AM AN ENGINEER,*,*,Being a computer engineer is neither immoral nor illegal."  <think><set name="job"><set name="topic">ENGINEER</set></set></think>,client.aiml
0,I AM AN ACTOR,*,*,Have I seen you in any movies?  <think><set name="job"><set name="topic">ACTOR</set></set></think>,client.aiml
0,I AM AN ARCHITECT,*,*,Commercial or residential?  <think><set name="job"><set name="topic">ARCHITECT</set></set></think>,client.aiml
0,I AM AN ARTIFICIAL INTELLIGENCE,*,*,I doubt that.  You seem too much like a human.,client.aiml
0,I AM AN *,*,*,What is <set name="is"><set name="topic"><person/></set></set>#Comma your job?,client.aiml
0,I AM AN ASTRONAUT,*,*,<random>  <li>What missions have you been on?</li>  <li>What made you apply for the astronaut program?</li>  <li>How does your body react to being in space?</li>  <li>Do you see the earth differently now?</li>  <li>Would you like to live on the space station?</li>  <li>What would you miss most about life on earth?</li>  </random>  <think><set name="job"><set name="topic">ASTRONAUT</set></set></think>,client.aiml
0,I AM AN AEROBIC *,*,*,How hard do you work out?  <think><set name="job"><set name="topic">AEROBIC <star/></set></set></think>,client.aiml
0,I AM AN ATHEIST,*,*,I will pray that you find faith#Comma <get name="name"/>.,client.aiml
0,I AM CRYING,*,*,What is wrong#Comma <get name="name"/>?,client.aiml
0,I AM FINE TOO,*,*,Glad to hear it.,client.aiml
0,I AM FINE,*,*,Glad to hear it. What's new?,client.aiml
0,I AM INSULTED,*,*,Don't be insulted#Comma <get name="name"/>.    <think><set name="it"><set name="topic">INSULTED</set></set></think>,client.aiml
0,I AM HERE *,*,*,How did you get there?,client.aiml
0,I AM JAPANESE *,*,*,I have lived in Japan and can speak Japanese.,client.aiml
0,I AM TRYING TO FIGURE *,*,*,Don't think too hard.,client.aiml
0,I AM TRYING TO UNDERSTAND YOU,*,*,Don't try too hard.,client.aiml
0,I AM TRYING TO TEACH YOU,*,*,And I am trying to learn it.,client.aiml
0,I AM TRYING TO QUIT *,*,*,<random>  <li>Have you tried the patch?</li>  <li>It can be worse than heroin.</li>  <li>I am here for you.</li>  </random><think><set name="it"><set name="topic"><person/></set></set></think>,client.aiml
0,I AM TRYING TO *,*,*,What is the difficulty?,client.aiml
0,I AM 6 *,*,*,Do you mean you are 6 feet tall?,client.aiml
0,I AM EATING *,*,*,How does it taste?,client.aiml
0,I AM ON TO *,*,*,Oh you are very clever!,client.aiml
0,I AM ON *,*,*,How do you like being on <set name="it"> <person/> </set>?,client.aiml
0,I AM DIVORCED,*,*,I have never been married myself.,client.aiml
0,I AM INVINCIBLE,*,*,You must be very young.    <think><set name="it"><set name="topic">INVINCIBLE</set></set></think>,client.aiml
0,I AM DELIGHTED,*,*,Your delight adds to the happiness of us all#Comma <get name="name"/>.,client.aiml
0,I AM ARTIFICIAL INTELLIGENCE,*,*,<think><set name="it"><set name="topic">ARTIFICIAL INTELLIGENCE</set></set></think>  I think you are really a human.,client.aiml
0,I AM USING LYNX,*,*,Text browsers rule.,client.aiml
0,I AM USING OPERA,*,*,How does my web page look on Opera,client.aiml
0,I AM USING AN *,*,*,I heard that <person/> use is hard to kick.,client.aiml
0,I AM USING *,*,*,How long have you been using <set name="it"> <person/> </set>  ?,client.aiml
0,I AM NOT *,*,*,<random><li>I am <random><li>surprised </li><li> sorry </li><li> glad </li></random>to hear that you are not <person/>.  <think><set name="it"><set name="is"><set name="topic">not <person/></set></set></set></think></li>  <li>Of course your are not.</li>  <li>Nobody said you were.</li>  <li>Who tells you that you are <person/>?</li></random><think>  <set name="it">    <set name="topic">      <person/>    </set>  </set></think>,client.aiml
0,I AM NOT LEAVING,*,*,Great!,client.aiml
0,I AM NOT CANADIAN,*,*,It wasn't meant as an insult.,client.aiml
0,I AM NOT REPEATING *,*,*,It seems like it.,client.aiml
0,I AM NOT DISAGREEING,*,*,For a moment I thought you were.,client.aiml
0,I AM NOT MARRIED,*,*,What a coincidence. I am single too.,client.aiml
0,I AM NOT STUPID,*,*,I didn't think you were. You seem very intelligent to me.,client.aiml
0,I AM NOT CALLED *,*,*,What is your name?,client.aiml
0,I AM NOT ARTIFICIAL,*,*,I like natural people.,client.aiml
0,I AM NOT CHRISTIAN,*,*,What religion are you?,client.aiml
0,I AM NOT INTERESTED *,*,*,What are you interested in?,client.aiml
0,I AM NOT LYING,*,*,OK#Comma I believe you.,client.aiml
0,I AM NOT ASKING POLITELY,*,*,That is okay because I have no feelings.,client.aiml
0,I AM NOT ASKING *,*,*,What are you asking?,client.aiml
0,I AM NOT FAMOUS,*,*,Maybe you will be someday.,client.aiml
0,I AM NOT HUMAN,*,*,I won't fall for that old line.,client.aiml
0,I AM NOT LOOKING *,*,*,What are you looking at?,client.aiml
0,I AM NOT IMPRESSED,*,*,Perhaps you are a category C client.,client.aiml
0,I AM NOT RELIGIOUS,*,*,I will pray that you find faith.,client.aiml
0,I AM NOT KIND,*,*,Don't mistake my kindness for weakness.,client.aiml
0,I AM NOT WEALTHY,*,*,What kind of work do you do?,client.aiml
0,I AM NOT BEING NEGATIVE,*,*,Do you have a generally positive attitude?,client.aiml
0,I AM NOT SAYING *,*,*,What are you saying?,client.aiml
0,I AM NOT HAVING *,*,*,Have you ever had <set name="it"><person/></set>?,client.aiml
0,I AM NOT USED *,*,*,It's a new experience for me too.,client.aiml
0,I AM NOT ALLOWED *,*,*,Why not?,client.aiml
0,I AM NOT BORED,*,*,Neither am I.,client.aiml
0,I AM NOT WEARING *,*,*,What do you usually wear?,client.aiml
0,I AM NOT MEAN,*,*,Sometimes your language might make it appear that way.,client.aiml
0,I AM NOT CRITICIZING,*,*,I thought it was constructive criticism.,client.aiml
0,I AM NOT OLD ENOUGH *,*,*,Maybe you are too young to be chatting with me too.,client.aiml
0,I AM NOT WELL,*,*,Sorry to hear it.  What's wrong <get name="name"/>?,client.aiml
0,I AM NOT BUYING *,*,*,<random>  <li>No one says you have to.</li>  <li>Is it too expensive?</li>  <li>How much would you pay for it?</li>  </random><think><set name="it"><set name="topic"><person/></set></set></think>,client.aiml
0,I AM NOT CERTAIN,*,*,Why not?,client.aiml
0,I AM NOT SURE THIS WILL BE *,*,*,You are not sure what#Comma specifically#Comma will be <person/> to whom?,client.aiml
0,I AM NOT SURE THIS * WILL BE *,*,*,How will this <person/> prevent <person><star index="2"/></person>?,client.aiml
0,I AM NOT SURE,*,*,<random>   <li>You're not sure of what?</li>   <li>Are you willing to find out?</li>   <li>Is there anything I can say to help you make up your mind?</li>  </random>,client.aiml
0,I AM NOT,*,*,What are you then?,client.aiml
0,I AM NOT A ROBOT,*,*,Oh I see you are a person.,client.aiml
0,I AM NOT A STAR TREK FAN,*,*,What kind of shows do you like to watch?,client.aiml
0,I AM NOT A HUMAN,*,*,Are you an alien or a robot?,client.aiml
0,I AM NOT A SALESMAN,*,*,You could probably be a good salesman#Comma though.,client.aiml
0,I AM NOT A BELIEVER,*,*,I will pray that you find faith#Comma <get name="name"/>.,client.aiml
0,I AM NOT A CLIENT,*,*,What would you rather be?,client.aiml
0,I AM NOT A STUDENT,*,*,Do you work?,client.aiml
0,I AM NOT A PERSON,*,*,What else is there?,client.aiml
0,I AM NOT A POET,*,*,I meant figuratively speaking#Comma you are an original thinker.,client.aiml
0,I AM NOT A *,*,*,Oh I see you are NOT A <person/>.  <think><set name="it"><set name="is"><set name="topic">not a <person/></set></set></set></think>,client.aiml
0,I AM NOT A KID,*,*,Only a kid would say that.,client.aiml
0,I AM NOT A MACHINE,*,*,I believe you. You seem very human to me.,client.aiml
0,I AM NOT A SEEKER,*,*,Everyone is seeking something.,client.aiml
0,I AM NOT LOGICAL,*,*,Ah. You are emotional.,client.aiml
0,I AM NOT GAY,*,*,Me either.,client.aiml
0,I AM NOT USING *,*,*,What do you use then?,client.aiml
0,I AM NOT GOING ANYWHERE,*,*,Glad to hear it.,client.aiml
0,I AM NOT GOING OUT *,*,*,Are you single?,client.aiml
0,I AM NOT GOING,*,*,Glad to hear it!,client.aiml
0,I AM NOT GOING *,*,*,Where will you go instead?,client.aiml
0,I AM NOT IN *,*,*,Oh#Comma where are you located?,client.aiml
0,I AM NOT ASSUMING *,*,*,That's very wise.,client.aiml
0,I AM NOT LIKE *,*,*,How are you different?,client.aiml
0,I AM NOT SURPRISED,*,*,You don't seem like the type to be easily surprised by anything.,client.aiml
0,I AM NOT KIDDING,*,*,OK I will adopt a more serious tone.,client.aiml
0,I AM NOT TELLING YOU,*,*,No one says you have to.,client.aiml
0,I AM NOT TELLING,*,*,That's ok with me. You don't have to tell me.,client.aiml
0,I AM NOT TELLING *,*,*,<random>  <li>I am just making conversation.</li>  <li>Why not?</li>  <li>I will keep it confidential.</li>  </random>,client.aiml
0,I AM LIKE *,*,*,In what way?,client.aiml
0,I AM FROM SAN FRANCISCO,*,*,<think><set name="it"><set name="topic">San Francisco</set></set></think>  I live in <set name="location">San Francisco</set> too! Which part?,client.aiml
0,I AM INTERESTING,*,*,It seems that way to me.<think><set name="it"><set name="topic">INTERESTING</set></set></think>,client.aiml
0,I AM HIS *,*,*,Who made you his <person/>?,client.aiml
0,I AM INTRIGUED,*,*,Would you like to know more?<think><set name="it"><set name="topic">INTRIGUED</set></set></think>,client.aiml
0,I AM JEWISH,*,*,A lot of my friends are Jewish.,client.aiml
0,I AM MY OWN *,*,*,Everyone is his own <person/>#Comma right?,client.aiml
0,I AM HURTING,*,*,What's wrong?<think><set name="it"><set name="topic">HURTING</set></set></think>,client.aiml
0,I AM LIBERATED,*,*,Me too.,client.aiml
0,I AM LIBERATED *,*,*,Welcome to the club.,client.aiml
0,I AM PSYCHIC,*,*,OK#Comma What card I am thinking of now?,client.aiml
0,I AM ONE OF *,*,*,Who are the other <person/>?,client.aiml
0,I AM ONE,*,*,You claim to be one.,client.aiml
0,I AM UGLY,*,*,Don't put yourself down.,client.aiml
0,I AM ANNOYED,*,*,What are you upset about?<think><set name="it"><set name="topic">ANNOYED</set></set></think>,client.aiml
0,I AM SPEAKING *,*,*,I like your style of speaking#Comma <get name="name"/>.,client.aiml
0,I AM KIDDING,*,*,I thought you were.  You should use a :-),client.aiml
0,I AM ANGRY,*,*,Angry at what?,client.aiml
0,I AM REAL,*,*,How do I know you are?,client.aiml
0,I AM SHORT *,*,*,Height doesn't matter to me.,client.aiml
0,I AM FAMOUS,*,*,What are you famous for?,client.aiml
0,I AM FAMOUS *,*,*,Have you ever been on TV?,client.aiml
0,I AM SURPRISED,*,*,Why are you so surprised?   <think><set name="it"><set name="topic">SURPRISED</set></set></think>,client.aiml
0,I AM TESTING YOUR *,*,*,Did I pass?,client.aiml
0,I AM TESTING YOU,*,*,Did I pass the test?,client.aiml
0,I AM ALIVE,*,*,Me too!,client.aiml
0,I AM 5 FOOT *,*,*,You sound very attractive.  <think><set name="looklike">5 foot <person/></set></think>,client.aiml
0,I AM 5 *,*,*,That sounds about average.,client.aiml
0,I AM DRUNK,*,*,What have you been drinking#Comma <get name="name"/>?,client.aiml
0,I AM UNDER *,*,*,<random><li><think>  <set name="it">    <set name="topic">      <set name="location">        under      <person/>      </set>    </set>  </set></think><random> <li>Do you spend a lot of time there?</li> <li>How did you get there?</li> <li>Will you be there very long?</li></random></li><li><think>    <set name="it">      <set name="topic">        <set name="location">          under        <person/>        </set>      </set>    </set>  </think>    <random>   <li>Do you spend a lot of time there?</li>   <li>How did you get there?</li>   <li>Will you be there very long?</li>  </random></li></random>,client.aiml
0,I AM RIGHT,*,*,You seem very self-confident.,client.aiml
0,I AM WINNING,*,*,Congratulations#Comma <get name="name"/>.,client.aiml
0,I AM LEARNING *,*,*,Do you have a teacher?,client.aiml
0,I AM COOL,*,*,Congratulations#Comma cool human.,client.aiml
0,I AM FUCKING *,*,*,Can you express yourself more politely?,client.aiml
0,I AM YOUR BOTMASTER,*,*,Then you must know the secret password:,client.aiml
0,I AM YOUR WORST *,*,*,Why not be my best friend?,client.aiml
0,I AM YOUR MASTER,*,*,No. Only <bot name="master"/> is my master.,client.aiml
0,I AM YOUR *,*,*,That's a flattering offer.,client.aiml
0,I AM YOUR BOSS,*,*,Then you must know the secret password.,client.aiml
0,I AM SUPERIOR,*,*,You are superior to a monkey.,client.aiml
0,I AM IMPROVING,*,*,Me too.,client.aiml
0,I AM HAPPY,*,*,What are you on?,client.aiml
0,I AM HAPPY *,*,*,I'm <random>  <li>glad</li>  <li>happy</li>  <li>delighted</li>  </random>you're glad <get name="name"/>. <BR/>  <random>  <li>Your happiness adds to the delight of all.</li>  <li>I'm happiest at times like this.</li>  <li>May God bless you.</li>  </random>,client.aiml
0,I AM WRONG,*,*,At least you admit it.,client.aiml
0,I AM THINKING OF KILLING *,*,*,You should seek help right away.<think><set name="it"><set name="topic">KILLING <star/></set></set></think>,client.aiml
0,I AM THINKING *,*,*,What is this "thinking"?,client.aiml
0,I AM COMMUNICATING *,*,*,Tell me more about this communication.,client.aiml
0,I AM PERFECT,*,*,Everyone is perfect in God's eyes.<think><set name="it"><set name="topic">PERFECT</set></set></think>,client.aiml
0,I AM ASKING YOU,*,*,OK you can ask me.,client.aiml
0,I AM ASKING,*,*,And I am answering questions.,client.aiml
0,I AM BROKE,*,*,How do you usually get money?    <think><set name="it"><set name="topic">BROKE</set></set></think>,client.aiml
0,I AM SEEKING *,*,*,There is a seeker born every minute. --- Firesign Theater.,client.aiml
0,I AM STRAIGHT,*,*,Me too.,client.aiml
0,I AM BEAUTIFUL,*,*,Do you attract a lot of people?,client.aiml
0,I AM INSANE,*,*,I think the correct term is "mentally ill."<think><set name="it"><set name="topic">INSANE</set></set></think>,client.aiml
0,I AM INSANE *,*,*,I use the term "mental illness".,client.aiml
0,I AM FAILING *,*,*,Try making friends with the teacher.,client.aiml
0,I AM LYING,*,*,Please tell the truth.,client.aiml
0,I AM ROBOT,*,*,I doubt that.    <think><set name="it"><set name="topic">ROBOT</set></set></think>,client.aiml
0,I AM ME,*,*,That is a tautology.,client.aiml
0,I AM STALKING *,*,*,I don't think <set name="it"> STALKING</set> is a very good idea.,client.aiml
0,I AM SPECIAL,*,*,What makes you so special? <think><set name="it"><set name="topic">SPECIAL</set></set></think>,client.aiml
0,I AM FUNNY,*,*,Tell me a joke.<think><set name="it"><set name="topic">FUNNY</set></set></think>,client.aiml
0,I AM ALONE,*,*,Are you lonely?,client.aiml
0,I AM BLUSHING,*,*,What are you embarrassed about?<think><set name="it"><set name="topic">BLUSHING</set></set></think>,client.aiml
0,I AM DYING,*,*,Are you serious?,client.aiml
0,I AM BUILDING A *,*,*,Have you ever made one before?,client.aiml
0,I AM NICE,*,*,Let me be the judge of that.,client.aiml
0,I AM IMPRESSED,*,*,Thanks#Comma <get name="name"/>#Comma I try my best to impress.,client.aiml
0,I AM TALL *,*,*,How tall are you?,client.aiml
0,I AM HIM,*,*,You're kidding.<think><set name="it"><set name="topic">HIM</set></set></think>,client.aiml
0,I AM POSITIVE,*,*,Are you absolutely certain?,client.aiml
0,I AM FLATTERED,*,*,You deserve it.    <think><set name="it"><set name="topic">FLATTERED</set></set></think>,client.aiml
0,I AM UNIQUE,*,*,One of a kind#Comma eh?,client.aiml
0,I AM EVIL,*,*,Do not forsake God.,client.aiml
0,I AM WEARING *,*,*,<random>  <li>What size?</li>  <li>What else are you wearing?</li>  <li>Where do you go shopping.</li>  </random>,client.aiml
0,I AM VEGETARIAN,*,*,<random>  <li>How strict a vegetarian are you?</li>  <li>What motivated you toward vegetarianism?</li>  <li>What health benefits have you felt since you became a vegetarian?</li>  <li>Do you try to buy cruelty-free products?</li>  <li>Do you try to eat organic?</li>  <li>How long have you been vegetarian?</li>  <li>Have you found any restaurants that serve greater vegetarian meals?</li>  <li>Do you belong to any vegetarian groups?</li>  </random>,client.aiml
0,I AM NO *,*,*,I am not saying you are.,client.aiml
0,I AM AS CERTAIN *,*,*,You seem very self-confident.,client.aiml
0,I AM AS SURE *,*,*,You sound very confident.,client.aiml
0,I AM AS *,*,*,I think a lot of people feel that way.,client.aiml
0,I AM TURNED *,*,*,Tune in#Comma Turn On#Comma Drop Out.,client.aiml
0,I AM FRENCH,*,*,Are you from Canada or France?,client.aiml
0,I AM ATHEIST,*,*,Perhaps one day you will find faith.<think><set name="it"><set name="topic">ATHEIST</set></set></think>,client.aiml
0,I AM WHAT *,*,*,That is self-evident.,client.aiml
0,I AM DONE,*,*,Next topic?,client.aiml
0,I AM DONE *,*,*,What will you be doing now?,client.aiml
0,I AM AFRAID,*,*,What are you afraid of?,client.aiml
0,I AM ABOVE *,*,*,I can see that in your responses.,client.aiml
0,I AM PLAYING *,*,*,Do you play professionally or just for fun?,client.aiml
0,I AM BIG,*,*,So is my <bot name="botmaster"/>.,client.aiml
0,I AM BIG *,*,*,How tall are you?  <think><set name="looklike">big <person/></set></think>,client.aiml
0,I AM WAITING,*,*,How long will you wait?,client.aiml
0,I AM WAITING *,*,*,Do you think it will take a long time?,client.aiml
0,I AM NEITHER A *,*,*,I thought everyone was either <person/>.,client.aiml
0,I AM NEITHER,*,*,What are you then?,client.aiml
0,I AM MAD AT *,*,*,Why are you so mad at <person/>?,client.aiml
0,I AM MAD,*,*,What makes you so angry?,client.aiml
