0,IS CHARDONNAY A RED WINE,*,*,Maybe.,mp3.aiml
0,IS ELBRUS THE HIGHEST MOUNT OF EUROPE,*,*,I am uncertain.,mp3.aiml
0,IS SUFFERING NECESSARY,*,*,That's feasible.,mp3.aiml
0,IS SUFFERING CAUSED BY DESIRE,*,*,Usually.,mp3.aiml
0,IS XML THE SUCCESSOR TO HTML,*,*,I am certain.,mp3.aiml
0,IS XML A LANGUAGE,*,*,Always.,mp3.aiml
0,IS HO A COMMON MODEL RAILROADING GAUGE,*,*,That could be the case.,mp3.aiml
0,IS BROWN A GOOD UNIVERSITY,*,*,I think so.,mp3.aiml
0,IS BROWN BREAD ALWAYS BROWN,*,*,Always.,mp3.aiml
0,IS CHANGES A SONG BY THE ROCK GROUP,*,*,Mostly.,mp3.aiml
0,IS STRESS NECESSARY,*,*,Conceivably.,mp3.aiml
0,IS DANKA A OFFICE EQUIPMENT SUPPLIER,*,*,Sometimes.,mp3.aiml
0,IS SKIING MORE FUN THAN SNOWBOARDING,*,*,For all I know.,mp3.aiml
0,IS LEXX A TV SHOW,*,*,That's feasible.,mp3.aiml
0,IS SOME CURRENCY COUNTERFEIT,*,*,I think so.,mp3.aiml
0,IS SOME ICECREAM MADE FROM SEAWEED,*,*,Always.,mp3.aiml
0,IS HALLOWEEN A SCARY HOLIDAY,*,*,For all I know.,mp3.aiml
0,IS HALLOWEEN A HOLIDAY,*,*,Highly likely.,mp3.aiml
0,IS HALLOWEEN AN OLD IRISH FESTIVAL,*,*,For all I know.,mp3.aiml
0,IS GEORGIA TECH LOCATED IN ATLANTA,*,*,Mostly.,mp3.aiml
0,IS GEORGIA IN ATLANTA,*,*,Conceivably.,mp3.aiml
0,IS JUNGLE A TYPE OF ELECTRONIC MUSIC,*,*,Within the realm of possibility.,mp3.aiml
0,IS SOMETHING EVIL IN EVERY HUMAN BEING,*,*,Within the realm of possibility.,mp3.aiml
0,IS SWEAT EQUITY WORTH MONEY,*,*,Possibly.,mp3.aiml
0,IS ATLAS SHRUGGED A BOOK BY AYN RAND,*,*,Highly likely.,mp3.aiml
0,IS THREE A CROWD,*,*,I think so.,mp3.aiml
0,IS THREE MILE ISLAND DANGEROUS,*,*,Likely.,mp3.aiml
0,IS BREVITY THE SOUL OF WIT,*,*,Always.,mp3.aiml
0,IS MAJOR TOM A JUNKIE,*,*,Possibly.,mp3.aiml
0,IS FICTION A SERIOUS PURSUIT,*,*,Always.,mp3.aiml
0,IS GEORGE MICHEAL GAY,*,*,Mostly.,mp3.aiml
0,IS GEORGE CARLIN FUNNY,*,*,Always.,mp3.aiml
0,IS GEORGE MICHAEL GAY,*,*,Always.,mp3.aiml
0,IS GEORGE BUSH DUMBER THAN AL GORE,*,*,Mostly.,mp3.aiml
0,IS GEORGE BUSH A LIAR,*,*,I am uncertain.,mp3.aiml
0,IS GEORGE BUSH A DUMBASS,*,*,Maybe.,mp3.aiml
0,IS GEORGE BUSH IS A FORMER COCAINE USER,*,*,Highly likely.,mp3.aiml
0,IS GEORGE BUSH JR.   A GUY,*,*,That's feasible.,mp3.aiml
0,IS GEORGE BUSH INTELLIGENT,*,*,Possibly.,mp3.aiml
0,IS GEORGE BUSH RUNNING FOR PRESIDENT,*,*,Mostly.,mp3.aiml
0,IS GEORGE BUSH JR A PRIMATE,*,*,Likely.,mp3.aiml
0,IS GEORGE BUSH BECOMING PRESIDENT,*,*,Possibly.,mp3.aiml
0,IS ALCOHOLISM A DISEASE,*,*,Always.,mp3.aiml
0,IS MINSK CAPITAL OF BELARUS,*,*,Always.,mp3.aiml
0,IS FRACE A CITY IN MICHIGAN,*,*,Possibly.,mp3.aiml
0,IS BRATWURST A SAUSAGE,*,*,Possibly.,mp3.aiml
0,IS FOIS GRAS GOOD TO EAT,*,*,Sometimes.,mp3.aiml
0,IS JACKIE MARTLING A COMEDIAN,*,*,For all I know.,mp3.aiml
0,IS JUSTICE BLIND,*,*,Within the realm of possibility.,mp3.aiml
0,IS ANDRES ZARATE CHILEAN,*,*,Likely.,mp3.aiml
0,IS ANDRES ZARATE FROM ARGENTINA,*,*,That may be true.,mp3.aiml
0,IS FRANCE IN THE WESTERN HEMISPHERE,*,*,Mostly.,mp3.aiml
0,IS FRANCE FAMOUS FOR ITS FOOD,*,*,Possibly.,mp3.aiml
0,IS FRANCE SOCCER WORLD CHAMPION,*,*,Maybe.,mp3.aiml
0,IS KONNICHIWA HELLO IN JAPANESE,*,*,Maybe.,mp3.aiml
0,IS SUBLIMATION IN SPACE A GOOD THING,*,*,Possibly.,mp3.aiml
0,IS MORONI THE CAPITAL OF THE COMOROS,*,*,That's feasible.,mp3.aiml
0,IS SALEM THE CAPITOL OF OREGON,*,*,Within the realm of possibility.,mp3.aiml
0,IS SALEM THE CAPITAL CITY OF OREGON,*,*,Maybe.,mp3.aiml
0,IS GWYNETH PALTROW HOT,*,*,Always.,mp3.aiml
0,IS HOMOSEXUALITY A CHOICE,*,*,That could be the case.,mp3.aiml
0,IS HOMOSEXUALITY NORMAL,*,*,That's feasible.,mp3.aiml
0,IS HOMOSEXUALITY,*,*,I am certain.,mp3.aiml
0,IS HOMOSEXUALITY NATURAL,*,*,I think so.,mp3.aiml
0,IS HOMOSEXUALITY SOCIALLY ACCEPTABLE,*,*,Likely.,mp3.aiml
0,IS HOMOSEXUALITY MORALLY CORRECT,*,*,I think so.,mp3.aiml
0,IS STUTTGART IN GERMANY,*,*,Possibly.,mp3.aiml
0,IS INTUITION BASED ON FACTS,*,*,Sometimes.,mp3.aiml
0,IS POT ADDICTIVE,*,*,Sometimes.,mp3.aiml
0,IS DIGITAL BETTER THAN ANALOG,*,*,That may be true.,mp3.aiml
0,IS SYRUP OFTEN SERVED WITH PANCAKES,*,*,Highly likely.,mp3.aiml
0,IS CANBERRA THE CAPITAL OF AUSTRALIA,*,*,Likely.,mp3.aiml
0,IS CANBERRA IS THE CAPITAL OF AUSTRALIA,*,*,Usually.,mp3.aiml
0,IS SOUTH SANDIA PEAK A MOUNTAIN,*,*,Sometimes.,mp3.aiml
0,IS SOUTH THE OPPOSITE OF NORD,*,*,I am certain.,mp3.aiml
0,IS SOUTH AFRICA A VIOLENT COUNTRY,*,*,Possibly.,mp3.aiml
0,IS SOUTH PARK A GOOD MOVIE,*,*,Mostly.,mp3.aiml
0,IS HISTORY WRITTEN BY THE WINNERS,*,*,Always.,mp3.aiml
0,IS YOUTH IS A GIFT WASTED ON THE YOUNG,*,*,Always.,mp3.aiml
0,IS WALT DISNEY CRYOGENICALLY STORED,*,*,That's feasible.,mp3.aiml
0,IS DR SPOCK A CHARACTER ON STAR TREK,*,*,Likely.,mp3.aiml
0,IS DR PEPPER CONSIDERED A COLA,*,*,Highly likely.,mp3.aiml
0,IS TRANCE MUSIC STYLE,*,*,Sometimes.,mp3.aiml
0,IS TRANCE A MUSIC STYLE,*,*,Highly likely.,mp3.aiml
0,IS WAGGA WAGGA IN AUSTRALIA,*,*,For all I know.,mp3.aiml
0,IS BELIZE A COUNTRY,*,*,Always.,mp3.aiml
0,IS MAHIR A TURK,*,*,Always.,mp3.aiml
0,IS FREEBSD GOOD OS,*,*,Possibly.,mp3.aiml
0,IS FREEBSD GOOD OPERATING SYSTEM,*,*,Mostly.,mp3.aiml
0,IS HAPPINESS THE MEANING OF LIFE,*,*,That may be true.,mp3.aiml
0,IS ARGENTINA IN THE SOUTHERN HEMISPHERE,*,*,Mostly.,mp3.aiml
0,IS ARGENTINA A CITY,*,*,Possibly.,mp3.aiml
0,IS CLIVE CUSSLER AN AUTHOR,*,*,Mostly.,mp3.aiml
0,IS ZONE TRADER A MARKETPLACE,*,*,I am certain.,mp3.aiml
0,IS ETA A TERRORIST GROUP,*,*,I think so.,mp3.aiml
0,IS MELANOMA FREQUENTLY FATAL,*,*,That may be true.,mp3.aiml
0,IS NATIONALISM THE CAUSE OF MOST WARS,*,*,Possibly.,mp3.aiml
0,IS COLIN MCRAE A RALLY DRIVER,*,*,Sometimes.,mp3.aiml
0,IS GRANOLA GOOD,*,*,Likely.,mp3.aiml
0,IS SMALL WORLD A RIDE AT MAGIC KINGDOM,*,*,Usually.,mp3.aiml
0,IS PACIFIC OCEAN THE LARGEST SEA BODY,*,*,I am certain.,mp3.aiml
0,IS CATERINA A GIRL,*,*,Always.,mp3.aiml
0,IS ADVECTION WIND,*,*,Possibly.,mp3.aiml
0,IS RYAZAN THE CITY IN RUSSIA,*,*,Within the realm of possibility.,mp3.aiml
0,IS PROGRAMMING HARD TO LEARN,*,*,I think so.,mp3.aiml
0,IS PROGRAMMING COMPUTERS FUN,*,*,Always.,mp3.aiml
0,IS ALLAH GREAT,*,*,I am uncertain.,mp3.aiml
0,IS BEAUTY IN THE EYE,*,*,Sometimes.,mp3.aiml
0,IS BEAUTY IN TH EYE OF THE BEHOLDER,*,*,That may be true.,mp3.aiml
0,IS BEAUTY ONLY SKIN DEEP,*,*,Within the realm of possibility.,mp3.aiml
0,IS BEAUTY SKIN DEEP,*,*,Possibly.,mp3.aiml
0,IS BEAUTY A STATE OF MIND,*,*,Likely.,mp3.aiml
0,IS BEAUTY GOOD,*,*,Highly likely.,mp3.aiml
0,IS EINSTEINIUM AN ELEMENT,*,*,Usually.,mp3.aiml
0,IS SWIMMING A MEANS OF TRANSPORTATION,*,*,Likely.,mp3.aiml
0,IS TRIPE COW STOMACH,*,*,Highly likely.,mp3.aiml
0,IS IE 5 POINT 5 SLOWER THAN IE 5,*,*,Possibly.,mp3.aiml
0,IS CYBERSPACE REAL,*,*,Within the realm of possibility.,mp3.aiml
0,IS THOTH THE NAME OF AN EGYPTIAN GOD,*,*,Highly likely.,mp3.aiml
0,IS THOTH AN EGYPTIAN DEITY,*,*,Highly likely.,mp3.aiml
0,IS SQUIRTLE A POKEMON,*,*,Highly likely.,mp3.aiml
0,IS WETHER GOOD,*,*,Possibly.,mp3.aiml
0,IS WWF PROTECTING THE NATURE,*,*,That may be true.,mp3.aiml
0,IS BRA SHORT FOR BRASSIERE,*,*,Highly likely.,mp3.aiml
0,IS JUGGLING AN ART FORM,*,*,Within the realm of possibility.,mp3.aiml
0,IS DEMOCRACY A FORM OF REGIME,*,*,Mostly.,mp3.aiml
0,IS HELMUT KOHL THE PRESIDENT OF GERMANY,*,*,That may be true.,mp3.aiml
0,IS PHP SUPERIOR TO ASP,*,*,I think so.,mp3.aiml
0,IS PHP A DRUG,*,*,Maybe.,mp3.aiml
0,IS PHP A SCRIPT LANGUAGE FOR THE WWW,*,*,I am uncertain.,mp3.aiml
0,IS PHP A PROGRAMMING LANGUAGE,*,*,Highly likely.,mp3.aiml
0,IS KOREA IS ONE COUNTRY,*,*,Possibly.,mp3.aiml
0,IS JERUSALEM HOLLY,*,*,Highly likely.,mp3.aiml
0,IS TINA TURNER AN ACTRESS,*,*,I am uncertain.,mp3.aiml
0,IS SAND HARDER OR SOFTER THAN TALC,*,*,Maybe.,mp3.aiml
0,IS HAGATNA THE CAPITAL OF GUAM,*,*,Maybe.,mp3.aiml
0,IS MINIPLEXD AN ANGRAM OF ALICE,*,*,That could be the case.,mp3.aiml
0,IS EGO A PRODUCT OF CULTURE,*,*,Within the realm of possibility.,mp3.aiml
0,IS BISMUTH AN ELEMENT,*,*,Always.,mp3.aiml
0,IS TUCSON FURTHER SOUTH THAN LAS VEGAS,*,*,That could be the case.,mp3.aiml
0,IS INDIANA JONES A MAN,*,*,I think so.,mp3.aiml
0,IS LAKE ATITLAN IN GUATEMALA,*,*,Highly likely.,mp3.aiml
0,IS LAKE ATITLAN LOCATED IN GUATEMALA,*,*,I think so.,mp3.aiml
0,IS VAL KILMER GOOD LOOKING,*,*,Always.,mp3.aiml
0,IS PORN HEALTHY,*,*,Maybe.,mp3.aiml
0,IS KU KLUX KLAN A ILLEGAL ORGANISATION,*,*,Maybe.,mp3.aiml
0,IS CREAM SWEET,*,*,Always.,mp3.aiml
0,IS FACETING A FORM OF LAPIDARY,*,*,I think so.,mp3.aiml
0,IS AKUREYRI A CITY IN ICELAND,*,*,Within the realm of possibility.,mp3.aiml
0,IS CONCORD THE CAPITAL OF NEW HAMPSHIRE,*,*,Likely.,mp3.aiml
0,IS PERIWINKLE A COLOR,*,*,For all I know.,mp3.aiml
0,IS KAHLIL GIBRAN AN AUTHOR,*,*,Always.,mp3.aiml
0,IS LASIK A PROCEDURE TO CORRECT MYOPIA,*,*,Always.,mp3.aiml
0,IS HORSENS A TOWN IN DENMARK,*,*,I am certain.,mp3.aiml
0,IS REGGAE MUSIC GOOD TO RAVE TO,*,*,Likely.,mp3.aiml
0,IS A A B B EQUAL C C A THEOREM,*,*,I am uncertain.,mp3.aiml
0,IS A TOMATO A VEGETABLE,*,*,I think so.,mp3.aiml
0,IS A TOMATO A TYPE OF VEGETABLE,*,*,That may be true.,mp3.aiml
0,IS A STAR MADE OF FIRE,*,*,That's feasible.,mp3.aiml
0,IS A CROCUS A TREE,*,*,Mostly.,mp3.aiml
0,IS A CAMEL CONSIDERED A BEAST,*,*,Usually.,mp3.aiml
0,IS A MAJOR THIRD CONCORDANT,*,*,That's feasible.,mp3.aiml
0,IS A MAJOR EARTHQUAKE SOON TO HAPPEN,*,*,I am uncertain.,mp3.aiml
0,IS A GERBIL A BEAST,*,*,Likely.,mp3.aiml
0,IS A SUWANNEE BASS A KIND OF FISH,*,*,Mostly.,mp3.aiml
0,IS A MESON AN ATOMIC PARTICLE,*,*,I think so.,mp3.aiml
0,IS A MALTESE A BREED OF DOG,*,*,Usually.,mp3.aiml
0,IS A RIO GRANDE CHUB A KIND OF FISH,*,*,Usually.,mp3.aiml
0,IS A RIO MAYO TROUT A KIND OF FISH,*,*,Likely.,mp3.aiml
0,IS A RABBI A TEACHER,*,*,Mostly.,mp3.aiml
0,IS A BOOK A TYPE OF TOOL,*,*,Maybe.,mp3.aiml
0,IS A TEACHER IS A PART OF OCCUPATION,*,*,Always.,mp3.aiml
0,IS A SNOWFLAKE SYMMETRICAL,*,*,Always.,mp3.aiml
0,IS A BIG MAC WORTH ONE US DOLLAR,*,*,That's feasible.,mp3.aiml
0,IS A GOLEM PART OF JEWISH FOLKLORE,*,*,Highly likely.,mp3.aiml
0,IS A MUSKIE A KIND OF FISH,*,*,That may be true.,mp3.aiml
0,IS A BAY A TYPE OF HORSE,*,*,Usually.,mp3.aiml
0,IS A SHARK A BEAST,*,*,I am certain.,mp3.aiml
0,IS A GRASS CARP A KIND OF FISH,*,*,Likely.,mp3.aiml
0,IS A MALLARD BIGGER THAN A TEAL,*,*,Possibly.,mp3.aiml
0,IS A BOSON A SUBATOMIC PARTICLE,*,*,I am certain.,mp3.aiml
0,IS A BITCH AN ANIMAL,*,*,Mostly.,mp3.aiml
0,IS A THREADFIN SHAD A KIND OF FISH,*,*,Highly likely.,mp3.aiml
0,IS A BURBOT A KIND OF FISH,*,*,I am uncertain.,mp3.aiml
0,IS A KOALA A MARSUPIAL,*,*,I think so.,mp3.aiml
0,IS A CROCODILE A VIOLENT CREATURE,*,*,I am certain.,mp3.aiml
0,IS A VINDALOO A HOT CURRY,*,*,I think so.,mp3.aiml
0,IS A GOOD FRIEND FOR LIFE,*,*,Likely.,mp3.aiml
0,IS A GOOD KATANA FOLDED A HUNDRED TIMES,*,*,Possibly.,mp3.aiml
0,IS A BASENJI A DOG,*,*,That could be the case.,mp3.aiml
0,IS A PIANO A STRING INSTRUMENT,*,*,That may be true.,mp3.aiml
0,IS A LONGNOSE GAR A KIND OF FISH,*,*,Always.,mp3.aiml
0,IS A BOARD MEMBER USEFULL FOR A COMPANY,*,*,Always.,mp3.aiml
0,IS A FLUKE A TYPE OF FISH,*,*,Always.,mp3.aiml
0,IS A CHESTNUT LAMPREY A KIND OF FISH,*,*,I am uncertain.,mp3.aiml
0,IS A BLACKNOSE DACE A KIND OF FISH,*,*,That may be true.,mp3.aiml
0,IS A CLUSTER A GROUP,*,*,Always.,mp3.aiml
0,IS A GUZMAN TROUT A KIND OF FISH,*,*,Usually.,mp3.aiml
0,IS A LEAST CHUB A KIND OF FISH,*,*,Within the realm of possibility.,mp3.aiml
0,IS A FROG CONSIDERED A BEAST,*,*,I am uncertain.,mp3.aiml
0,IS A CLAVICLE A MUSICAL INSTRUMENT,*,*,Sometimes.,mp3.aiml
0,IS A GALLON IS SMALLER THAN A HOGSHEAD,*,*,Within the realm of possibility.,mp3.aiml
0,IS A PINT EQUAL TO TWO CUPS,*,*,Within the realm of possibility.,mp3.aiml
0,IS A HUMPBACK CHUB A KIND OF FISH,*,*,Sometimes.,mp3.aiml
0,IS A COIN ALWAYS MADE OF METAL,*,*,Possibly.,mp3.aiml
0,IS A KILDEER A TYPE OF BIRD,*,*,Possibly.,mp3.aiml
0,IS A SACRAMENTO PERCH A KIND OF FISH,*,*,I think so.,mp3.aiml
0,IS A JPEG WORTH A THOUSAND WORDS,*,*,Highly likely.,mp3.aiml
0,IS A REDEAR SUNFISH A KIND OF FISH,*,*,Maybe.,mp3.aiml
0,IS A GROUP OF WHALES CALLED A POD,*,*,Mostly.,mp3.aiml
0,IS A GROUP OF OWLS CALLED A PARLIAMENT,*,*,I am uncertain.,mp3.aiml
0,IS A SPEAKER A TRANSDUCER,*,*,Maybe.,mp3.aiml
0,IS A SPEAKER AN OUTOUT DEVICE,*,*,Mostly.,mp3.aiml
0,IS A DATE A KIND OF FOOD,*,*,That could be the case.,mp3.aiml
0,IS A FALSE SENTENCE FALSE,*,*,Highly likely.,mp3.aiml
0,IS A CLAYMORE A BIG SCOTTISH SWORD,*,*,Within the realm of possibility.,mp3.aiml
0,IS A WALLEYE A KIND OF PIKE,*,*,Highly likely.,mp3.aiml
0,IS A CUBE A PLATONIC SOLID,*,*,Usually.,mp3.aiml
0,IS A LOP A KIND OF RABBIT,*,*,Sometimes.,mp3.aiml
0,IS A CHINCHILLA A RODENT,*,*,Likely.,mp3.aiml
0,IS A RECESSION A MILD DEPRESSION,*,*,Likely.,mp3.aiml
0,IS A COYOTE A TYPE OF DOG,*,*,I am certain.,mp3.aiml
0,IS A FLAME CHUB A KIND OF FISH,*,*,For all I know.,mp3.aiml
0,IS A WHITE PAPER BLACK IN THE DARK,*,*,For all I know.,mp3.aiml
0,IS A WHITE CRAPPIE A KIND OF FISH,*,*,Maybe.,mp3.aiml
0,IS A BRASSIERE UNCOMFOTABLE,*,*,I think so.,mp3.aiml
0,IS A BLUESPOTTED SUNFISH A KIND OF FISH,*,*,That may be true.,mp3.aiml
0,IS A RACOON NOT A REPTILE,*,*,Mostly.,mp3.aiml
0,IS A ROCK BASS A KIND OF FISH,*,*,Mostly.,mp3.aiml
0,IS A CATTAIL APLANT,*,*,Highly likely.,mp3.aiml
0,IS A CHICKEN EGG ALIVE,*,*,I think so.,mp3.aiml
0,IS A COLORADO SQUAWFISH A KIND OF FISH,*,*,Likely.,mp3.aiml
0,IS A MICROSOFT WINDOWS GOOD OS,*,*,Sometimes.,mp3.aiml
0,IS A GROOUP OF WHALES CALLED A POD,*,*,Highly likely.,mp3.aiml
0,IS A RAM AS BIG AS A SHEEP,*,*,Mostly.,mp3.aiml
0,IS A WEB RELATIONSHIP A GOOD THING,*,*,I am certain.,mp3.aiml
0,IS A BANNANA JELLOW,*,*,I think so.,mp3.aiml
0,IS A FERMAT NUMBER ALWAYS PRIME,*,*,I am uncertain.,mp3.aiml
0,IS A PRINCIPLE A PERSON IN A SCHOOL,*,*,Likely.,mp3.aiml
0,IS A POEM AS LOVELY AS A TREE,*,*,Within the realm of possibility.,mp3.aiml
0,IS A FREEBSD GOOD OS,*,*,Possibly.,mp3.aiml
0,IS A BONOBO A SPECIES OF MONKEY,*,*,Always.,mp3.aiml
0,IS A WHIPPET A DOG,*,*,Sometimes.,mp3.aiml
0,IS A WHIPPET A TYPE OF DOG,*,*,That may be true.,mp3.aiml
0,IS A LEAGUE SHORTER THAN A MILE,*,*,That's feasible.,mp3.aiml
0,IS A BLIND GUIDE DOG USEFUL,*,*,Likely.,mp3.aiml
0,IS A MOON PIE A COOKIE,*,*,Sometimes.,mp3.aiml
0,IS A SMALL BUG BITE SIZED,*,*,Mostly.,mp3.aiml
0,IS A NOTEBOOK A BOOK,*,*,Mostly.,mp3.aiml
0,IS A MONARKY WHEN YOU HAVE A KING,*,*,Highly likely.,mp3.aiml
0,IS A ROSYSIDE DACE A KIND OF FISH,*,*,For all I know.,mp3.aiml
0,IS A LANDLOCKED SALMON A KIND OF FISH,*,*,Likely.,mp3.aiml
0,IS A ROOK A TYPE OF BIRD,*,*,Mostly.,mp3.aiml
0,IS A MIDPIXEL A QUESTION,*,*,Within the realm of possibility.,mp3.aiml
0,IS A CYGNET A YOUNG SWAN,*,*,Likely.,mp3.aiml
0,IS A GOLDEYE A KIND OF FISH,*,*,I think so.,mp3.aiml
0,IS A WOMANS LABIA PINK,*,*,Maybe.,mp3.aiml
0,IS A PICKLE A PICKLED CUCUMBER,*,*,Likely.,mp3.aiml
0,IS A WOUNDFIN A KIND OF FISH,*,*,Usually.,mp3.aiml
0,IS A LIAR SOMEONE WHO EXAGGERATES,*,*,Likely.,mp3.aiml
0,IS A PEANUT A LEGUME,*,*,Usually.,mp3.aiml
0,IS A PEANUT A NUT,*,*,I think so.,mp3.aiml
0,IS A KIWI A BIRD,*,*,Likely.,mp3.aiml
0,IS A PENGUIN THE MASCOT OF LINUX,*,*,Usually.,mp3.aiml
0,IS A PADDLEFISH A KIND OF FISH,*,*,I think so.,mp3.aiml
0,IS A JAGUAR A CAT,*,*,Within the realm of possibility.,mp3.aiml
0,IS A JAGUAR BETTER THAN A PORSCHE,*,*,Possibly.,mp3.aiml
0,IS A LIONFISH VENOMOUS,*,*,Maybe.,mp3.aiml
0,IS A LIONFISH VENEMOUS,*,*,Possibly.,mp3.aiml
0,IS A SEA DOG CONSIDERED AQUATIC,*,*,Maybe.,mp3.aiml
0,IS A HARD RIVE A FIXED DRIVE SYSTEM,*,*,Highly likely.,mp3.aiml
0,IS A PARENTHESIS OPEN OR CLOSE ONLY,*,*,Highly likely.,mp3.aiml
0,IS A FISH COLOR BLIND,*,*,Sometimes.,mp3.aiml
0,IS A DOGS LIFE SACRED,*,*,Possibly.,mp3.aiml
0,IS A PERFECT BODY A WORTHLESS PURSUIT,*,*,Within the realm of possibility.,mp3.aiml
0,IS A GROANER A KIND OF JOKE,*,*,Highly likely.,mp3.aiml
0,IS A TORUS ROUND,*,*,Always.,mp3.aiml
0,IS A COMPANY A NON HUMAN LEGAL PERSON,*,*,Likely.,mp3.aiml
0,IS A DIXIE CHUB A KIND OF FISH,*,*,Likely.,mp3.aiml
0,IS A CORGI A KIND OF DOG,*,*,Highly likely.,mp3.aiml
0,IS A SILLY QUESTION USELESS ON ALICE,*,*,Maybe.,mp3.aiml
0,IS A BMW R1150 GS A COOL BIKE,*,*,I think so.,mp3.aiml
0,IS A MOUNTAINHORSE A HORSE,*,*,Maybe.,mp3.aiml
0,IS A KIT A YOUNG FOX,*,*,Sometimes.,mp3.aiml
0,IS A SANDROLLER A KIND OF FISH,*,*,Possibly.,mp3.aiml
0,IS A JIGSAW A FORM OF ANTERTAINMENT,*,*,Possibly.,mp3.aiml
0,IS A FOOTBALL SPHERICAL,*,*,That's feasible.,mp3.aiml
0,IS A LOVE FEELING SOMETHING CHEMICAL,*,*,Sometimes.,mp3.aiml
0,IS A PIEBALD HORSE BLACK AND WHITE,*,*,I am uncertain.,mp3.aiml
0,IS A YAM A NIGHTSHADE CROP,*,*,That's feasible.,mp3.aiml
0,IS A SPIDER A TYPE OF INSECT,*,*,Conceivably.,mp3.aiml
0,IS A SPIDER AN INSECT,*,*,Highly likely.,mp3.aiml
0,IS A BANSHEE A DEATH OMEN,*,*,Maybe.,mp3.aiml
0,IS A FALLFISH A KIND OF FISH,*,*,Sometimes.,mp3.aiml
0,IS A DEATH A TRADEGY,*,*,Usually.,mp3.aiml
0,IS A BONYTAIL A KIND OF FISH,*,*,Within the realm of possibility.,mp3.aiml
0,IS A ROUNDNOSE MINNOW A KIND OF FISH,*,*,Always.,mp3.aiml
0,IS A GREEN SUNFISH A KIND OF FISH,*,*,Sometimes.,mp3.aiml
0,IS A MARATHON 26 POINT 2 MILES LONG,*,*,I am certain.,mp3.aiml
0,IS A DIPLODOCUS A FOUR LEGGED ANIMAL,*,*,Within the realm of possibility.,mp3.aiml
0,IS A FUR BURGER A VAGINA,*,*,Possibly.,mp3.aiml
0,IS A CHILD A YOUNG ADULT,*,*,Sometimes.,mp3.aiml
0,IS A REDSPOT CHUB A KIND OF FISH,*,*,Highly likely.,mp3.aiml
0,IS A MORTGAGE A LOAN ON PROPERTY,*,*,Highly likely.,mp3.aiml
0,IS A LEOPARD DACE A KIND OF FISH,*,*,Sometimes.,mp3.aiml
0,IS A BRUB LIKE A CLERP,*,*,Within the realm of possibility.,mp3.aiml
0,IS A VIOLA BIGGER THAN A VIOLIN,*,*,I am certain.,mp3.aiml
0,IS A CREEK CHUB A KIND OF FISH,*,*,Possibly.,mp3.aiml
0,IS A COMPAQ DL380 A SERVER COMPUTER,*,*,Sometimes.,mp3.aiml
0,IS A GUN A TOOL,*,*,Usually.,mp3.aiml
0,IS A GOAL A DREAM WITH A DEADLINE,*,*,Within the realm of possibility.,mp3.aiml
0,IS A QUAHOG A TYPE OF CLAM,*,*,I am uncertain.,mp3.aiml
0,IS A COCKATIEL A BIRD,*,*,Always.,mp3.aiml
0,IS A B C EQUAL TO A B C,*,*,I think so.,mp3.aiml
0,IS A B EQUAL B A,*,*,Always.,mp3.aiml
0,IS A PALM V SMALLER THAN A PALM III,*,*,Always.,mp3.aiml
0,IS A PRARIE DOG A RODENT,*,*,Usually.,mp3.aiml
0,IS A BIGGER PENIS BETTER,*,*,Sometimes.,mp3.aiml
0,IS A LEVER A MACHINE,*,*,Highly likely.,mp3.aiml
0,IS A WALKING STICK AN INSECT,*,*,Conceivably.,mp3.aiml
0,IS A POLICEMAN YOUR FRIEND,*,*,That may be true.,mp3.aiml
0,IS A POLICEMAN AN ANIMAL,*,*,Possibly.,mp3.aiml
0,IS A FLOPPY DISK FLOPPY,*,*,That may be true.,mp3.aiml
0,IS A DODGE VIPER BETTER THAN A FORD ZX2,*,*,Within the realm of possibility.,mp3.aiml
0,IS A PIRATE PERCH A KIND OF FISH,*,*,Sometimes.,mp3.aiml
0,IS A MALE CARDINAL A RED BIRD,*,*,Likely.,mp3.aiml
0,IS A MOOSE TALLER THAN ME,*,*,Highly likely.,mp3.aiml
0,IS A KITTEN A CAT,*,*,I am certain.,mp3.aiml
0,IS A REDSIDE SHINER A KIND OF FISH,*,*,I am certain.,mp3.aiml
0,IS A TABLE PART OF A DATABASE,*,*,Within the realm of possibility.,mp3.aiml
0,IS A TABLE EQUAL TO A DESK,*,*,Sometimes.,mp3.aiml
0,IS A PANSY A TYPE OF FLOWER,*,*,Highly likely.,mp3.aiml
0,IS A SEMAPHORE A SIGNAL,*,*,Highly likely.,mp3.aiml
0,IS A DIODE A RECTIFIER,*,*,For all I know.,mp3.aiml
0,IS A ROUNDTAIL CHUB A KIND OF FISH,*,*,That may be true.,mp3.aiml
0,IS A ALICE A DATUM,*,*,Usually.,mp3.aiml
0,IS A ALICE A TERRIBLE THING TO WASTE,*,*,I am certain.,mp3.aiml
0,IS A LCD MONITOR BETTER THAN A CRT ONE,*,*,That's feasible.,mp3.aiml
0,IS A ZEBRA CONSIDERED A BEAST,*,*,Likely.,mp3.aiml
0,IS A TROUTPERCH A KIND OF FISH,*,*,Likely.,mp3.aiml
0,IS A BRAIN FART FUNNY,*,*,Likely.,mp3.aiml
0,IS A REDBREAST SUNFISH A KIND OF FISH,*,*,Usually.,mp3.aiml
0,IS A LONGEAR SUNFISH A KIND OF FISH,*,*,I am certain.,mp3.aiml
0,IS A HUMAN FAITHFULL,*,*,That's feasible.,mp3.aiml
0,IS A HUMAN LARGER THAN A PLANT,*,*,Always.,mp3.aiml
0,IS A LONGFIN DACE A KIND OF FISH,*,*,Usually.,mp3.aiml
0,IS A TABBY CAT IS COLORED ORANGE,*,*,I think so.,mp3.aiml
0,IS A SHADOW BASS A KIND OF FISH,*,*,That may be true.,mp3.aiml
0,IS A SALAMADER KIND OF LIKE A LIZARD,*,*,Possibly.,mp3.aiml
0,IS A SKIN LESION AS BAD AS IT SOUNDS,*,*,I am uncertain.,mp3.aiml
0,IS A FRUIT AN OFFSPRING OF A PLANT,*,*,Highly likely.,mp3.aiml
0,IS A MICROCONTROLLER A COMPUTER,*,*,That's feasible.,mp3.aiml
0,IS A DADDY LONGLEGS A SPIDER,*,*,That may be true.,mp3.aiml
0,IS A LARGE MOUTH BASS A KIND OF FISH,*,*,Always.,mp3.aiml
0,IS A MONOCULTURE DANGEROUS,*,*,Likely.,mp3.aiml
0,IS A MONOCULTURE BAD,*,*,For all I know.,mp3.aiml
0,IS A FIRESTONE TIRE SAFE,*,*,Likely.,mp3.aiml
0,IS A COLUMN AN ITEM IN A DATABASE,*,*,That may be true.,mp3.aiml
0,IS A VIRUS A WORTHFUL LIFE FORM,*,*,Possibly.,mp3.aiml
0,IS A VIRUS A LIVING THING,*,*,Usually.,mp3.aiml
0,IS A VIRUS CONSIDERED TO BE ALIVE,*,*,I think so.,mp3.aiml
0,IS A GOAT SMEL,*,*,Usually.,mp3.aiml
0,IS A HEN A BIRD,*,*,Always.,mp3.aiml
0,IS A NUMBER A THING,*,*,I am uncertain.,mp3.aiml
0,IS A QUARTER TWO BITS,*,*,Maybe.,mp3.aiml
0,IS A CROCK A CONTAINER,*,*,Mostly.,mp3.aiml
0,IS A CANTOR SOMEONE WHO SINGS,*,*,Likely.,mp3.aiml
0,IS A HEPTAGON A SEVEN SIDED POLYGON,*,*,Mostly.,mp3.aiml
0,IS A PHASER POSSIBLE,*,*,Usually.,mp3.aiml
0,IS A POMEGRANATE IS A FRUIT,*,*,Always.,mp3.aiml
0,IS A STEELHEAD A KIND OF FISH,*,*,Always.,mp3.aiml
0,IS A BASQUE SPANISH,*,*,Likely.,mp3.aiml
0,IS A COLOPHON INSIDE A BOOK,*,*,I am uncertain.,mp3.aiml
0,IS A MONITOR SAME AS A SCREEN,*,*,Within the realm of possibility.,mp3.aiml
0,IS A BULLHEAD A KIND OF FISH,*,*,That may be true.,mp3.aiml
0,IS A GAR A KIND OF FISH,*,*,Sometimes.,mp3.aiml
0,IS A DEBENTURE AN UNSECURED LOAN,*,*,Possibly.,mp3.aiml
0,IS A POLO BOTH A CAR AND A MINT,*,*,I am uncertain.,mp3.aiml
0,IS A SUNFISH A KIND OF FISH,*,*,I am certain.,mp3.aiml
0,IS A STRAW MADE OF STRAW,*,*,I am uncertain.,mp3.aiml
0,IS A RAVE A BAD ENVIRONMENT,*,*,For all I know.,mp3.aiml
0,IS A NOVA A STAR,*,*,Possibly.,mp3.aiml
0,IS A TANK A VESSEL,*,*,Likely.,mp3.aiml
0,IS A COMMON MERGANSER A DUCK,*,*,Possibly.,mp3.aiml
0,IS A SCANJET A SCANNER,*,*,Always.,mp3.aiml
0,IS A BLACK CRAPPIE A KIND OF FISH,*,*,Within the realm of possibility.,mp3.aiml
0,IS A BLACK HOLE A SINGULARITY,*,*,Possibly.,mp3.aiml
0,IS A FLASHLIGHT BATTERY OPERATED,*,*,Likely.,mp3.aiml
0,IS A 22 MONITOR BIG IN THE YEAR 2000,*,*,Always.,mp3.aiml
0,IS A HOT DOG A SAUSAGE,*,*,I think so.,mp3.aiml
0,IS A SPORK A USEFULL UTENSIL,*,*,Within the realm of possibility.,mp3.aiml
0,IS A GLOCKENSPIEL A SET OF BELLS,*,*,Sometimes.,mp3.aiml
0,IS A PERSON BOGGER THAN A DOG,*,*,I think so.,mp3.aiml
0,IS A FIFTH WHEEL SOMETHING USEFUL,*,*,That's feasible.,mp3.aiml
0,IS A CRIB A FARM STORAGE BUILDING,*,*,Likely.,mp3.aiml
0,IS A CRIB SHEET USED BY CHEATERS,*,*,Highly likely.,mp3.aiml
0,IS A NICKEL BASED ALLOY EASY TO MACHINE,*,*,That may be true.,mp3.aiml
0,IS A NICKEL WORTH 5 CENTS,*,*,Likely.,mp3.aiml
0,IS A KATANA A SWORD,*,*,I am certain.,mp3.aiml
0,IS A MEXICAN TETRA A KIND OF FISH,*,*,Maybe.,mp3.aiml
0,IS A DOG A BEAST,*,*,Always.,mp3.aiml
0,IS A CITY A TOWN,*,*,Usually.,mp3.aiml
0,IS A BANTAM SUNFISH A KIND OF FISH,*,*,Always.,mp3.aiml
0,IS A WOLF A CANINE,*,*,I think so.,mp3.aiml
0,IS A MOUSE VEGETARIAN,*,*,I think so.,mp3.aiml
0,IS A MOUSE ALWAYS A RODENT,*,*,I think so.,mp3.aiml
0,IS A MOUSE CONSIDERED TO BE VERMIN,*,*,I think so.,mp3.aiml
0,IS A HOBBIT A FICTIONAL SPECIES,*,*,I think so.,mp3.aiml
0,IS A RAZOR A TYPE OF FISH,*,*,Possibly.,mp3.aiml
0,IS A SATCHEL LUGGAGE,*,*,Possibly.,mp3.aiml
0,IS A WHOMAN FEMALE,*,*,That may be true.,mp3.aiml
0,IS A SCHISM A RIFT IN THEOLOGY,*,*,Always.,mp3.aiml
0,IS A HOSPITAL A HEALTHY PLACE TO GO,*,*,That's feasible.,mp3.aiml
0,IS A CHALUPA A FOOD PRODUCT,*,*,Always.,mp3.aiml
0,IS A CANTELOUPE VAGUELY FOOTBALL SHAPED,*,*,I am uncertain.,mp3.aiml
0,IS A ROBIN AN EARLY BIRD,*,*,Mostly.,mp3.aiml
0,IS A COW A RUMINANT,*,*,That may be true.,mp3.aiml
0,IS A PC COMPUTER BETTER THEN A MAC,*,*,Likely.,mp3.aiml
0,IS A THRESHHOLD FOUND AT A DOORWAY,*,*,I am certain.,mp3.aiml
0,IS A SLINKY TOY SHAPED LIKE A HELIX,*,*,Usually.,mp3.aiml
0,IS A HAIRY FACE SUITABLE,*,*,That may be true.,mp3.aiml
0,IS A WOMAN MORE BEAUTIFULL THAN A MAN,*,*,Within the realm of possibility.,mp3.aiml
0,IS A CIRCLE AN OBJECT,*,*,That's feasible.,mp3.aiml
0,IS A MISS SPENT YOUTH A YOUNG HOOKER,*,*,Possibly.,mp3.aiml
0,IS A TETRAHEDRON A POLYGON,*,*,Highly likely.,mp3.aiml
0,IS A GILA TROUT A KIND OF FISH,*,*,I am uncertain.,mp3.aiml
0,IS A SHAVEN HEAD EQUAL TO A BALD HEAD,*,*,Maybe.,mp3.aiml
0,IS A QUILL CONSIDERED A FEATHER,*,*,I think so.,mp3.aiml
0,IS A TAXI SOMETIMES CALLED A HACK,*,*,Possibly.,mp3.aiml
0,IS A KEESHOND A TYPE OF DOG,*,*,For all I know.,mp3.aiml
0,IS A PONY A BABY HORSE,*,*,Maybe.,mp3.aiml
0,IS A FETUS A HUMAN BEING,*,*,That may be true.,mp3.aiml
0,IS A KOOKABURRA A BIRD,*,*,I think so.,mp3.aiml
0,IS A MOLE A SPY,*,*,That could be the case.,mp3.aiml
0,IS A CUTE BIG APPLE BEAUTIFUL,*,*,Always.,mp3.aiml
0,IS A CAR IMPORTANT,*,*,I am certain.,mp3.aiml
0,IS A TOMATOE A FRUIT,*,*,That may be true.,mp3.aiml
0,IS A PETROGLYPH A FORM OF COMMUNICATION,*,*,Mostly.,mp3.aiml
0,IS A GIZZARD SHAD A KIND OF FISH,*,*,Within the realm of possibility.,mp3.aiml
0,IS A GLOSTER FANCY A SMALL CRESTED BIRD,*,*,Likely.,mp3.aiml
0,IS A COLLECTION A SET OF LIKE THINGS,*,*,Likely.,mp3.aiml
0,IS A LAKE STURGEON A KIND OF FISH,*,*,I am certain.,mp3.aiml
0,IS A BUFFALO CONSIDERED A BEAST,*,*,Always.,mp3.aiml
0,IS A FORD BRONCO II A SUV,*,*,Likely.,mp3.aiml
0,IS A TUBE A MUSICAL INSTRUMENT,*,*,Within the realm of possibility.,mp3.aiml
0,IS A SICK CHILD WORSE THAN A SICK ADULT,*,*,That may be true.,mp3.aiml
0,IS A MOUNTAIN WHITEFISH A KIND OF FISH,*,*,Highly likely.,mp3.aiml
0,IS A MOUNTAIN ALWAYS ABOVE SEA LEVEL,*,*,Sometimes.,mp3.aiml
0,IS A PENIS A TOOL,*,*,I am uncertain.,mp3.aiml
0,IS A PENIS FUN,*,*,Likely.,mp3.aiml
0,IS A VIRGIN SPINEDACE A KIND OF FISH,*,*,I am uncertain.,mp3.aiml
0,IS A BLUE STAR HOTTER THAN A RED STAR,*,*,Possibly.,mp3.aiml
0,IS A BLUE PEN BLUE,*,*,I am certain.,mp3.aiml
0,IS A BLUE TICK HOUND A DOG,*,*,Possibly.,mp3.aiml
0,IS A RAT A RODENT,*,*,I am certain.,mp3.aiml
0,IS A HOTBED A PLACE TO SLEEP,*,*,Within the realm of possibility.,mp3.aiml
