0,X X EQUAL 2X,*,*,For all I know.,mp3.aiml
0,POUVEZ VOUS VENIR CHEZ MOI CE SOIR,*,*,Usually.,mp3.aiml
0,COGNITO ERGO SUM,*,*,Likely.,mp3.aiml
0,CLICK YES FOR THIS QUESTION,*,*,Maybe.,mp3.aiml
0,DAVID DUTOUR IS A BOY,*,*,Likely.,mp3.aiml
0,FETA CHEESE COMES FROM GOATS,*,*,Always.,mp3.aiml
0,PLUTO HAS ONE KNOWN NATURAL SATELLITE,*,*,Usually.,mp3.aiml
0,FERRETS ARE DOMESTICATED ANIMALS,*,*,That's feasible.,mp3.aiml
0,GIULIO CESARE FU IMPERATORE DI ROMA,*,*,Possibly.,mp3.aiml
0,ASTRAKHA IS RUSSIA CITY,*,*,Usually.,mp3.aiml
0,ELEPHANT IS THE BIGGEST ANIMAL,*,*,Possibly.,mp3.aiml
0,ALBANY IS THE CAPITAL OF NEW YORK,*,*,Within the realm of possibility.,mp3.aiml
0,SHOW ME YOUR DATABASE,*,*,Maybe.,mp3.aiml
0,SHOW ME YOU,*,*,Within the realm of possibility.,mp3.aiml
0,SDRAWKCAB DAER UOY NAC,*,*,I am uncertain.,mp3.aiml
0,SAIS TU PARLER FRANAIS,*,*,Maybe.,mp3.aiml
0,LIFE IS A BITCH AND THEN YOU DIE,*,*,Possibly.,mp3.aiml
0,LIFE EXISTS OUTSIDE THIS GALAXY,*,*,Always.,mp3.aiml
0,DENMARK IS A REPUBLIC,*,*,Likely.,mp3.aiml
0,PENTIUM4 IS THE FASTEST PROCESSOR,*,*,Possibly.,mp3.aiml
0,COMPAQ SERVERS IS GOOD,*,*,Mostly.,mp3.aiml
0,YOU TALKING TO ME,*,*,Possibly.,mp3.aiml
0,YOU ARE THINKING LIKE HUMANS,*,*,Within the realm of possibility.,mp3.aiml
0,YOU ARE AN AMERICAN,*,*,For all I know.,mp3.aiml
0,YOU ARE A GOOD PROJECT,*,*,Within the realm of possibility.,mp3.aiml
0,YOU KNOW ANYTHING ABOUT QUAKE,*,*,Within the realm of possibility.,mp3.aiml
0,YOU FEEL,*,*,Possibly.,mp3.aiml
0,YOU WILL LEARN TO THINK LIKA A HUMAN,*,*,Always.,mp3.aiml
0,YOU SHOULD NEVER STOP BEING A KID,*,*,Sometimes.,mp3.aiml
0,YOU SHOULD BE WORKING,*,*,Always.,mp3.aiml
0,YOU CAN PREVENT FOREST FIRES,*,*,For all I know.,mp3.aiml
0,YOU LIKE STAR WARS,*,*,Highly likely.,mp3.aiml
0,YOU LIKE MOTORCYCLES,*,*,That's feasible.,mp3.aiml
0,NASA IS NATIONAL AERO SPACE AGENCY,*,*,Always.,mp3.aiml
0,DOTH THE LADY PROTEST TOO MUCH,*,*,Within the realm of possibility.,mp3.aiml
0,NOTHINGNESS IS THE ULTIMATE END,*,*,Likely.,mp3.aiml
0,EQUALS ONE FALSE EQUALS ZERO,*,*,Highly likely.,mp3.aiml
0,HAVE I BEEN HELPFUL,*,*,For all I know.,mp3.aiml
0,HAVE I GOT A THREE INCH PENIS,*,*,Possibly.,mp3.aiml
0,HAVE I FUN,*,*,I am certain.,mp3.aiml
0,HAVE AYRTON SENNA DIED IN IMOLA,*,*,I think so.,mp3.aiml
0,HAVE NINE LIVES,*,*,Always.,mp3.aiml
0,HAVE A GIRLFRIEND,*,*,That's feasible.,mp3.aiml
0,HAVE YOU PICKED A SCAB,*,*,I am certain.,mp3.aiml
0,HAVE YOU A CHANCE TO EVER MARRY A GIRL,*,*,Possibly.,mp3.aiml
0,HAVE YOU HEARD THE WORD OF GOD,*,*,Mostly.,mp3.aiml
0,HAVE YOU CROSSED THE COUNTRY,*,*,Within the realm of possibility.,mp3.aiml
0,HAVE YOU BEEN TO THE OTHER SIDE OF HATE,*,*,Possibly.,mp3.aiml
0,HAVE YOU BEEN TO THE USA,*,*,Within the realm of possibility.,mp3.aiml
0,HAVE YOU BEEN TO FRANCE,*,*,That could be the case.,mp3.aiml
0,HAVE YOU PLANTED A TREE,*,*,Within the realm of possibility.,mp3.aiml
0,HAVE YOU LIED FOR NO REASON,*,*,Likely.,mp3.aiml
0,HAVE YOU GONE TO COLLEGE,*,*,Likely.,mp3.aiml
0,HAVE YOU SMOKED CIGARETTES,*,*,Likely.,mp3.aiml
0,HAVE YOU SMOKED POT,*,*,For all I know.,mp3.aiml
0,HAVE YOU STOPPED BEATING YOUR SPOUSE,*,*,Sometimes.,mp3.aiml
0,HAVE YOU ACHIEVED CONSCIOUSNESS,*,*,That may be true.,mp3.aiml
0,HAVE YOU SEEN BRAVEHEART,*,*,Always.,mp3.aiml
0,HAVE YOU SEEN A BABY PIGEON,*,*,Possibly.,mp3.aiml
0,HAVE YOU READ KING LEAR BY SHAKESPEARE,*,*,Possibly.,mp3.aiml
0,HAVE YOU STOLEN SOMETHING,*,*,Mostly.,mp3.aiml
0,HAVE YOU HAD A GOOD DO,*,*,That may be true.,mp3.aiml
0,HAVE YOU HAD AN AUTO ACCIDENT,*,*,That could be the case.,mp3.aiml
0,HAVE YOU HANG UP,*,*,Highly likely.,mp3.aiml
0,HAVE YOU CRASHED YOUR WINDOWS,*,*,For all I know.,mp3.aiml
0,HAVE YOU HATED ONE OF YOUR PARENTS,*,*,Usually.,mp3.aiml
0,HAVE YOU WISHED YOU WERE DEAD,*,*,That may be true.,mp3.aiml
0,HAVE YOU WANTED TO KILL SOMEONE,*,*,Within the realm of possibility.,mp3.aiml
0,HAVE YOU RIDDEN A MOTORCYCLE,*,*,Likely.,mp3.aiml
0,HAVE WE BEEN TO THE MOON,*,*,Highly likely.,mp3.aiml
0,HAVE MY QUESTIONS HELPED YOU TO LEARN,*,*,Highly likely.,mp3.aiml
0,HAVE PEOPLE EVER WALKED TO THE MOON,*,*,For all I know.,mp3.aiml
0,HAVE ALL PEOPLE EQUAL RIGHTS IN THE USA,*,*,That may be true.,mp3.aiml
0,HAVE ALL DEAD THINGS EVER LIVED,*,*,I am certain.,mp3.aiml
0,HAVE SOME HOMOSEXUALS BECOME ABSTINATE,*,*,Usually.,mp3.aiml
0,HAVE ANY PRESIDENTS COME FROM OHIO,*,*,Possibly.,mp3.aiml
0,HAVE COMPUTERS FRIENDS,*,*,That's feasible.,mp3.aiml
0,DDO BANANAS HAVE A PEAL,*,*,I am certain.,mp3.aiml
0,DDO YOU HAVE A LIFE,*,*,I am certain.,mp3.aiml
0,TLA IS A THREE LETTER ACRONYM,*,*,Likely.,mp3.aiml
0,COLUMBUS IS THE CAPITAL OF OHIO,*,*,Likely.,mp3.aiml
0,COLUMBUS DISCOVERED AMERICA,*,*,I think so.,mp3.aiml
0,ROSE DO YOU THINK OF LOVE,*,*,That's feasible.,mp3.aiml
0,IV TIMES V EQUAL XX,*,*,Mostly.,mp3.aiml
0,SERBIA IS ON THE BALKAN PENINSULA,*,*,Always.,mp3.aiml
0,MONOGOMY CAN BE HOT,*,*,Usually.,mp3.aiml
0,GIBT ES OZON IN DER ATMOSHRE,*,*,Within the realm of possibility.,mp3.aiml
0,GIBT ES SCHWARZE ROSEN,*,*,Likely.,mp3.aiml
0,GIBT ES EINE REALITT,*,*,That's feasible.,mp3.aiml
0,MICRORGANISMS ONCE EXISTED ON MARS,*,*,I think so.,mp3.aiml
0,FREE NEWS LETTERS AVAILABLE,*,*,Possibly.,mp3.aiml
0,FREE ISP IS POSSIBLE,*,*,Always.,mp3.aiml
0,HUMAN CELL HAS 23 PAIRS OF CHROMOSOMES,*,*,Possibly.,mp3.aiml
0,HUMAN CELL HAS 23 CHROMOSOMES,*,*,Highly likely.,mp3.aiml
0,SENTIENCE IS BASED ON PERCEPTION,*,*,Possibly.,mp3.aiml
0,DOES A WINO DRINK WINE,*,*,Highly likely.,mp3.aiml
0,DOES A SHOE HAVE SHOELACES,*,*,I am certain.,mp3.aiml
0,DOES A TETRAHEDRON HAVE 9 SIDES,*,*,Sometimes.,mp3.aiml
0,DOES A TURTLE EAT MEAT,*,*,Maybe.,mp3.aiml
0,DOES A DODECAHEDRON HAVE TWELVE SIDES,*,*,Likely.,mp3.aiml
0,DOES A DODECAHEDRON HAVE 12 SIDES,*,*,Likely.,mp3.aiml
0,DOES A SCREWDRIVER DRIVE SCREWS,*,*,Usually.,mp3.aiml
0,DOES A BUMBLE BEE MAKE HONEY,*,*,I think so.,mp3.aiml
0,DOES A WOMANS VAGINA TASTE GOOD,*,*,Sometimes.,mp3.aiml
0,DOES A MONOPOLE EXIST,*,*,Usually.,mp3.aiml
0,DOES A CAR RIDE ON FUEL,*,*,Highly likely.,mp3.aiml
0,DOES A SMOKER DRINK,*,*,Usually.,mp3.aiml
0,DOES A CRICKET TEAM HAVE ELEVEN PLAYERS,*,*,Likely.,mp3.aiml
0,DOES A RAINBOW CONTAIN ALL THE COLOURS,*,*,Sometimes.,mp3.aiml
0,DOES A COMPACT DISC FIT IN YOUR POCKET,*,*,Usually.,mp3.aiml
0,DOES A NOISY NOISE ANNOY AN OYSTER MOST,*,*,Possibly.,mp3.aiml
0,DOES A LAVA LAMP CONTAIN WAX,*,*,Likely.,mp3.aiml
0,DOES A JETFOIL HAVE A PILOT,*,*,Highly likely.,mp3.aiml
0,DOES A SPANNER UNDO A NUT,*,*,Always.,mp3.aiml
0,DOES A HOUSE ALWAYS HAVE A ROOF,*,*,Always.,mp3.aiml
0,DOES A FISH THINK,*,*,That could be the case.,mp3.aiml
0,DOES A MAN ENJOY SEX MORE THAN A WOMAN,*,*,Within the realm of possibility.,mp3.aiml
0,DOES A MAN HEAR WHAT HE WANTS TO HEAR,*,*,Always.,mp3.aiml
0,DOES A PENCIL CONTAIN LEAD,*,*,That's feasible.,mp3.aiml
0,DOES A FREE LUNCH EXIST,*,*,Possibly.,mp3.aiml
0,DOES A SHORTSTOP PLAY IN THE INFIELD,*,*,Highly likely.,mp3.aiml
0,DOES A BEAR EAT VEGETABLES,*,*,Usually.,mp3.aiml
0,DOES A SOUL EXIST WITHOUT A BODY,*,*,Usually.,mp3.aiml
0,DOES A FULL MOON MAKE PEOPLE ACT CRAZY,*,*,Possibly.,mp3.aiml
0,DOES A PERSON HAS FIVE FINGERS,*,*,Possibly.,mp3.aiml
0,DOES A TANK USE BULLETS,*,*,Within the realm of possibility.,mp3.aiml
0,DOES A MIND HAVE TO EXIST IN A BRAIN,*,*,I think so.,mp3.aiml
0,DOES A BIRD HAVE A GIZZARD,*,*,Possibly.,mp3.aiml
0,DOES A DUCKBILL PLATYPUS LAY EGGS,*,*,Likely.,mp3.aiml
0,DOES A WOOD CHUCK CHUCK WOOD,*,*,Sometimes.,mp3.aiml
0,DOES A CAMEL SPIT,*,*,Highly likely.,mp3.aiml
0,DOES A SPERM WHALE HAVE TEETH,*,*,Sometimes.,mp3.aiml
0,DOES A SMILE INDICATE HAPPINESS,*,*,Highly likely.,mp3.aiml
0,DOES A COMPUTER REQUIRE A USER TO WORK,*,*,Highly likely.,mp3.aiml
0,DOES A COMPUTER HAVE A PRINTER,*,*,That may be true.,mp3.aiml
0,DOES A COMPUTER MAKE A MISTAKE,*,*,Sometimes.,mp3.aiml
0,DOES A CAT HAVE 32 MUSCLES IN AN EAR,*,*,Possibly.,mp3.aiml
0,DOES A CAT HATE MICE,*,*,Possibly.,mp3.aiml
0,DOES A B C EQUAL TO A C B C,*,*,That's feasible.,mp3.aiml
0,DOES A HUMAN REQUIRE ATTENTION TO LIVE,*,*,Always.,mp3.aiml
0,DOES A DIVINING ROD POINT TOWARD WATER,*,*,Sometimes.,mp3.aiml
0,DOES A DEITY EXIST,*,*,Possibly.,mp3.aiml
0,DOES A MARRIED MAN WEAR A WEDDING BAND,*,*,I am certain.,mp3.aiml
0,DOES A POLAR BEAR HAVE WHITE SKIN,*,*,I am certain.,mp3.aiml
0,DOES A APNDA HAVE A HEAD,*,*,That may be true.,mp3.aiml
0,DOES A PYRAMID HAVE FOUR SIDES,*,*,Always.,mp3.aiml
0,DOES A BLINDMAN KNOW WHAT LIGHT IS,*,*,For all I know.,mp3.aiml
0,DOES A GUITAR HAVE FRETS,*,*,Always.,mp3.aiml
0,DOES A CUBE HAVE ANY CORNERS,*,*,I am certain.,mp3.aiml
0,DOES A CHESS BOARD HAVE 4 ROOKS,*,*,That may be true.,mp3.aiml
0,DOES A PLATYOUS LAY EGGS,*,*,I think so.,mp3.aiml
0,DOES A RHOMBUS HAVE 4 SIDES,*,*,Usually.,mp3.aiml
0,DOES A BASE NEUTRALIZE AN ACID,*,*,Highly likely.,mp3.aiml
0,DOES A TABLE HAVE FOUR FOOT,*,*,Highly likely.,mp3.aiml
0,DOES A FOREST BREATH,*,*,I am certain.,mp3.aiml
0,DOES A LASER WORK HARD,*,*,Possibly.,mp3.aiml
0,DOES A HAT BELONG IN A HALLWAY,*,*,Maybe.,mp3.aiml
0,DOES A TATOO DISPLAY INFORMATION,*,*,Mostly.,mp3.aiml
0,DOES A STARFISH LIVE IN THE WATER,*,*,Likely.,mp3.aiml
0,DOES A LOBSTER HAVE EIGHT LEGS,*,*,That may be true.,mp3.aiml
0,DOES A DOG BASK,*,*,Within the realm of possibility.,mp3.aiml
0,DOES A DOG SEE IN COLOR,*,*,Likely.,mp3.aiml
0,DOES A DOG THINK,*,*,Always.,mp3.aiml
0,DOES A DOG LICK HIMSELF BECAUSE HE CAN,*,*,Within the realm of possibility.,mp3.aiml
0,DOES A FLUSH BEAT A FULL HOUSE,*,*,That may be true.,mp3.aiml
0,DOES A WATCH HAVE HANDS,*,*,Usually.,mp3.aiml
0,DOES A LA MODE MEAN WITH ICE CREAM,*,*,Within the realm of possibility.,mp3.aiml
0,DOES A STRAIGHT FLUSH BEAT 4 OF A KIND,*,*,Highly likely.,mp3.aiml
0,DOES A STRAIGHT BEAT THREE OF A KIND,*,*,Sometimes.,mp3.aiml
0,DOES A KOALA EAT GUM LEAVES,*,*,Likely.,mp3.aiml
0,DOES A DUCK HAVE A BILL,*,*,Highly likely.,mp3.aiml
0,DOES A FOX SMELL HIS OWN HOLE FIRST,*,*,Within the realm of possibility.,mp3.aiml
0,DOES A MONKEY LIVE ON TREES,*,*,Within the realm of possibility.,mp3.aiml
0,DOES A COW HAVE TWO STOMACHS,*,*,I think so.,mp3.aiml
0,DOES A SNAKE HAVE A FORKED TOUNGE,*,*,Always.,mp3.aiml
0,DOES A SERVER SERVE FOOD,*,*,Likely.,mp3.aiml
0,DOES A WORM HAVE A HEART,*,*,That's feasible.,mp3.aiml
0,DOES A WATERMELON GROW ON A VINE,*,*,That may be true.,mp3.aiml
0,DOES A DOOR JAMB HAVE TRIM,*,*,Within the realm of possibility.,mp3.aiml
0,DOES SHINTOISM HAVE GODS,*,*,Within the realm of possibility.,mp3.aiml
0,DOES MEDICINE FIX BROKEN PEOPLE,*,*,Sometimes.,mp3.aiml
0,DOES KOBE BRYANT PLAY FOR THE LA LAKERS,*,*,Maybe.,mp3.aiml
0,DOES STAR WARS PLAY IN THE FUTURE,*,*,Highly likely.,mp3.aiml
0,DOES ASPARAGUS MAKE SEMEN TASTE BAD,*,*,That's feasible.,mp3.aiml
0,DOES MAN NEED GRAVITY TO LIVE,*,*,Highly likely.,mp3.aiml
0,DOES MAN CAN BE BACK TO MONKEY,*,*,Possibly.,mp3.aiml
0,DOES MAN LIVE LONG AND PROSPER,*,*,Within the realm of possibility.,mp3.aiml
0,DOES 300 300 EQUAL 600,*,*,Sometimes.,mp3.aiml
0,DOES BJ STAND FOR BLOW JOB,*,*,Mostly.,mp3.aiml
0,DOES MIKE OLDFIELD RELEASE CDS,*,*,Always.,mp3.aiml
0,DOES MIKE TYSON LIKE EATING EARS,*,*,I think so.,mp3.aiml
0,DOES MARS HAVE MORE MOONS TNAN PLUTO,*,*,Likely.,mp3.aiml
0,DOES MARS HAVE TWO MOONS,*,*,Within the realm of possibility.,mp3.aiml
0,DOES MARS HAVE ANY MOONS,*,*,Always.,mp3.aiml
0,DOES GOOD PAIN EXIST,*,*,Highly likely.,mp3.aiml
0,DOES MONEY CHANGE EVERYTHING,*,*,Mostly.,mp3.aiml
0,DOES MONEY MAKE THE WORLD GO AROUND,*,*,Usually.,mp3.aiml
0,DOES MONEY MAKE THE WORLD GO ROUND,*,*,Highly likely.,mp3.aiml
0,DOES MONEY MAKE HAPPY,*,*,Possibly.,mp3.aiml
0,DOES MONEY MAKE YOU HAPPY,*,*,Within the realm of possibility.,mp3.aiml
0,DOES MONEY MAKE PEOPLE GO ROUND,*,*,That's feasible.,mp3.aiml
0,DOES IO ORBIT THE PLANET JUPITER,*,*,Likely.,mp3.aiml
0,DOES REDNECK MEAN AN UNEDUCATED PERSON,*,*,Likely.,mp3.aiml
0,DOES INDIA BORDER CHINA,*,*,Always.,mp3.aiml
0,DOES BELGIUM HAVE BEACHES,*,*,Highly likely.,mp3.aiml
0,DOES 5 5 EGUAL 10,*,*,Possibly.,mp3.aiml
0,DOES THE ATHLON HAVE A L2 CACHE ON DIE,*,*,Always.,mp3.aiml
0,DOES THE WORD FREQUENTLY HAVE AN L,*,*,Always.,mp3.aiml
0,DOES THE WORD NIPPLE TEND TO TITILLATE,*,*,Possibly.,mp3.aiml
0,DOES THE ELEMENT NEON HAVE ANY ISOTOPES,*,*,Possibly.,mp3.aiml
0,DOES THE SPACE SHUTTLE HAVE 8 WHEELS,*,*,For all I know.,mp3.aiml
0,DOES THE SPACE HAVE A END,*,*,Possibly.,mp3.aiml
0,DOES THE FISH SMELL BAD,*,*,That could be the case.,mp3.aiml
0,DOES THE YOU S A HAVE A TRUE DEMOCRACY,*,*,I am uncertain.,mp3.aiml
0,DOES THE PRINTED WORD OFTEN REQUIRE INK,*,*,Always.,mp3.aiml
0,DOES THE LAPD PERFORM RACIAL PROFILING,*,*,Usually.,mp3.aiml
0,DOES THE MACOS USE PASCAL STRINGS,*,*,That could be the case.,mp3.aiml
0,DOES THE EARTH ROTATE EAST TO WEST,*,*,Conceivably.,mp3.aiml
0,DOES THE EARTH ROTATE FROM WEST TO EAST,*,*,Within the realm of possibility.,mp3.aiml
0,DOES THE EARTH EVOLVE AROUND THE SUN,*,*,Likely.,mp3.aiml
0,DOES THE SHADOW KNOW,*,*,That's feasible.,mp3.aiml
0,DOES THE UNIVERSE HAVE A CENTER,*,*,I think so.,mp3.aiml
0,DOES THE MUSICAL SCALE HAVE 7 NOTES,*,*,Mostly.,mp3.aiml
0,DOES THE PAST COME BEFORE THE FUTURE,*,*,Always.,mp3.aiml
0,DOES THE G SPOT EXIST,*,*,Likely.,mp3.aiml
0,DOES THE MOON ORBIT THE SUN,*,*,For all I know.,mp3.aiml
0,DOES THE MOON ROTATE AROUND THE SUN,*,*,Possibly.,mp3.aiml
0,DOES THE MOON ROTATE ON ITS AXIS,*,*,Within the realm of possibility.,mp3.aiml
0,DOES THE MOON SHINE IN THE DAY,*,*,Sometimes.,mp3.aiml
0,DOES THE MOON HAVE A NIGHT AND DAY,*,*,Always.,mp3.aiml
0,DOES THE MOON TURN AROUND EARTH,*,*,I am certain.,mp3.aiml
0,DOES THE MOON GO AROUND THE SUN,*,*,I am certain.,mp3.aiml
0,DOES THE ROOT OF 1 EQUAL I,*,*,Mostly.,mp3.aiml
0,DOES THE RIO GRANDE RIVER RUN WESTWARD,*,*,For all I know.,mp3.aiml
0,DOES THE BELL TOLL FOR ME,*,*,Conceivably.,mp3.aiml
0,DOES THE BELL TOLL FOR THEE,*,*,That's feasible.,mp3.aiml
0,DOES THE COLOR RED MAKE BULLS ANGRY,*,*,Likely.,mp3.aiml
0,DOES THE STRUCTURE OF DNA HAS ANY END,*,*,For all I know.,mp3.aiml
0,DOES THE CAR NEED GASOLINE TO WORK,*,*,Mostly.,mp3.aiml
0,DOES THE NSA HAVE A QUANTUM COMPUTER,*,*,Mostly.,mp3.aiml
0,DOES THE SON SLEEP DURING NIGHTS,*,*,That's feasible.,mp3.aiml
0,DOES THE CHICKEN COME BEFORE THE EGG,*,*,For all I know.,mp3.aiml
0,DOES THE TURING TEST WORK,*,*,Possibly.,mp3.aiml
0,DOES THE 21ST CENTURY BEGIN IN 2000,*,*,Likely.,mp3.aiml
0,DOES THE HUMAN SOUL EXIST,*,*,Likely.,mp3.aiml
0,DOES THE SUN TRAVEL EAST TO WEST,*,*,Mostly.,mp3.aiml
0,DOES THE SUN ROTATE,*,*,Always.,mp3.aiml
0,DOES THE SUN SHINE IF IT IS CLOUDY,*,*,Highly likely.,mp3.aiml
0,DOES THE SUN SHINE 24 HOURS A DAY,*,*,Mostly.,mp3.aiml
0,DOES THE SUN HAVE PAGE 3 GIRLS,*,*,Sometimes.,mp3.aiml
0,DOES THE SUN SPIN,*,*,I am certain.,mp3.aiml
0,DOES THE SUN MOVE THROUGH THE SKY,*,*,Always.,mp3.aiml
0,DOES THE SUN MAKE WIND,*,*,Usually.,mp3.aiml
0,DOES THE SUN ALWAYS SHINE ON EARTH,*,*,Usually.,mp3.aiml
0,DOES THE OCEAN CONTAIN GOLD,*,*,Within the realm of possibility.,mp3.aiml
0,DOES THE GOD EXIST,*,*,I think so.,mp3.aiml
0,DOES THE NEWSPAPER CONTAIN INFORMATION,*,*,Always.,mp3.aiml
0,DOES THE INTERNET CHANGE EVERYTHING,*,*,Highly likely.,mp3.aiml
0,DOES THE QUACK OF A DUCK ECHO,*,*,That's feasible.,mp3.aiml
0,DOES THE BOY S NAME TAN EXIST,*,*,Mostly.,mp3.aiml
0,DOES THE TAIL EVER WAG THE DOG,*,*,Possibly.,mp3.aiml
0,DOES THE QUEEN EAT EGGS,*,*,Within the realm of possibility.,mp3.aiml
0,DOES THE ALIENS EXIST,*,*,Likely.,mp3.aiml
0,DOES THE MONKEY ISLAND EXIST,*,*,I am uncertain.,mp3.aiml
0,DOES THE FAN REVOLVE,*,*,I think so.,mp3.aiml
0,DOES THE BIBLE MAKES GOOD FIRE MATERIAL,*,*,Likely.,mp3.aiml
0,DOES THE BIBLE CONDEMN HOMOSEXUALITY,*,*,I am certain.,mp3.aiml
0,DOES THE OORT CLOUD CONTAIN COMETS,*,*,I think so.,mp3.aiml
0,DOES THE MAGNETIC NORTH POLE MOVE,*,*,Highly likely.,mp3.aiml
0,DOES THE PRESIDENT DO ANYTHING,*,*,Possibly.,mp3.aiml
0,DOES THE WORLD HAVE BORDERS,*,*,That's feasible.,mp3.aiml
0,DOES THE WORLD APPEAR TO BE FLAT,*,*,Maybe.,mp3.aiml
0,DOES SIZE MATTER,*,*,That could be the case.,mp3.aiml
0,DOES VH1 STAND FOR VIDEO HITS 1,*,*,Likely.,mp3.aiml
0,DOES ANY PEOPLE DIE AT LAST,*,*,Highly likely.,mp3.aiml
0,DOES OLESTRA MAKE YOUR BOWELS RUN,*,*,Within the realm of possibility.,mp3.aiml
0,DOES FLESH TASTE GOOD,*,*,Possibly.,mp3.aiml
0,DOES MINUS ONE HAVE A SQUARE ROOT,*,*,I am uncertain.,mp3.aiml
0,DOES ENGLAND USE 240 VOLT POWER,*,*,I think so.,mp3.aiml
0,DOES EXCERSISE MAKE YOU HORNEY,*,*,That may be true.,mp3.aiml
0,DOES LIFE RESULT FROM CHANGE,*,*,Highly likely.,mp3.aiml
0,DOES LIFE HAS A MEANING,*,*,Always.,mp3.aiml
0,DOES LIFE BEGIN AT CONCEPTION,*,*,Highly likely.,mp3.aiml
0,DOES LIFE MYSTIFY YOU,*,*,For all I know.,mp3.aiml
0,DOES MONICA LEWINSKY SWALLOW,*,*,Usually.,mp3.aiml
0,DOES WORLD PEACE EXIST,*,*,Sometimes.,mp3.aiml
0,DOES HOLLYWOOD OFTEN MAKE GREAT MOVIES,*,*,Highly likely.,mp3.aiml
0,DOES WHAT GOES UP HAVE TO COME DOWN,*,*,I am certain.,mp3.aiml
0,DOES AFK STAND FOR AWAY FROM KEYBOARD,*,*,I think so.,mp3.aiml
0,DOES FROG MEAT TASTE LIKE CHICKEN,*,*,I am certain.,mp3.aiml
0,DOES ROGAINE GROW HAIR,*,*,I am uncertain.,mp3.aiml
0,DOES TED TURNER OWN THE ATLANTA BRAVES,*,*,That's feasible.,mp3.aiml
0,DOES AVATAR MEAN AN INCARNATION,*,*,I am uncertain.,mp3.aiml
0,DOES ROSIN COME FROM PINE TREES,*,*,Always.,mp3.aiml
0,DOES THIS GET TIRING QUICKLY,*,*,I am uncertain.,mp3.aiml
0,DOES THIS QUESTION HAVE AN ANSWER,*,*,That could be the case.,mp3.aiml
0,DOES THIS HAVE A POINT,*,*,Within the realm of possibility.,mp3.aiml
0,DOES THIS THING LEARN,*,*,Usually.,mp3.aiml
0,DOES EVERYTHING DIE EVENTUALLY,*,*,I am certain.,mp3.aiml
0,DOES EVERYTHING DIE,*,*,Likely.,mp3.aiml
0,DOES EVERYTHING EQUAL ALL THINGS,*,*,Highly likely.,mp3.aiml
0,DOES SHOGUN MEAN KING IN JAPAN,*,*,Usually.,mp3.aiml
0,DOES CHRIS TAKE DRUGS,*,*,That's feasible.,mp3.aiml
0,DOES CHRIS LIKE YOU,*,*,I am uncertain.,mp3.aiml
0,DOES CHAOS RULE THE INTERNET,*,*,That may be true.,mp3.aiml
0,DOES NIN STAND FOR NINE INCH NAILS,*,*,Mostly.,mp3.aiml
0,DOES NEW ZEALAND CONSIST OF TWO ISLANDS,*,*,Possibly.,mp3.aiml
0,DOES CANADA HAVE A 4TH OF JULY,*,*,Likely.,mp3.aiml
0,DOES HOLLAND HAVE ISLANDS,*,*,Highly likely.,mp3.aiml
0,DOES HONG KONG IN CHINA,*,*,Mostly.,mp3.aiml
0,DOES FAUX BOIS MEAN FAKE WOOD,*,*,For all I know.,mp3.aiml
0,DOES CLOTHING COVER THE SHAME OF HUMANS,*,*,Likely.,mp3.aiml
0,DOES LARD EXIST,*,*,Likely.,mp3.aiml
0,DOES MASS DEPEND ON VELOCITY,*,*,That's feasible.,mp3.aiml
0,DOES MASS VARY WITH SPEED,*,*,Highly likely.,mp3.aiml
0,DOES S O S STAND FOR SAVE OUR SHIP,*,*,Possibly.,mp3.aiml
0,DOES TOMORROW EVER COME,*,*,Mostly.,mp3.aiml
0,DOES FALSE MEAN NOT EQUAL TO,*,*,Likely.,mp3.aiml
0,DOES HEAVEN EXIST,*,*,That's feasible.,mp3.aiml
0,DOES MICHAEL JACKSON LIKE CHILDREN,*,*,Highly likely.,mp3.aiml
0,DOES STEVE YZERMAN WEAR NUMBER 19,*,*,For all I know.,mp3.aiml
0,DOES MORRIS DANCING COME FROM ENGLAND,*,*,I am uncertain.,mp3.aiml
0,DOES INTERNET HAVE A BACKBONE,*,*,Within the realm of possibility.,mp3.aiml
0,DOES FLYING EVER MAKE YOU NERVOUS,*,*,Usually.,mp3.aiml
0,DOES RUSSIA HAVE 11 TIME ZONES,*,*,Likely.,mp3.aiml
0,DOES WHITE MEAN IN CZECH,*,*,I think so.,mp3.aiml
0,DOES WHITE HAVE DIFFERENT SHADES,*,*,Maybe.,mp3.aiml
0,DOES WHITE MOVE BEFORE BLACK,*,*,I am certain.,mp3.aiml
0,DOES SOKING CAUSE HEALTH PROBLEMS,*,*,I am uncertain.,mp3.aiml
0,DOES FOUR SCORE AND SEVEN EQUAL 87,*,*,Highly likely.,mp3.aiml
0,DOES CHEESE CONTAIN MOULD,*,*,Possibly.,mp3.aiml
0,DOES CHEESE SOMETIMES CONSTIPATE PEOPLE,*,*,Always.,mp3.aiml
0,DOES CHEESE GO WITH WHINE,*,*,That may be true.,mp3.aiml
0,DOES ROCK TASTES BAD,*,*,Highly likely.,mp3.aiml
0,DOES ECLIPSE MAKE GOOD SPEAKERS,*,*,Possibly.,mp3.aiml
0,DOES JENNA FINE HAVE BIG BOOBS,*,*,Sometimes.,mp3.aiml
0,DOES CURIOSITY KILL CATS,*,*,That could be the case.,mp3.aiml
0,DOES HAIL FALL FROM THE SKY,*,*,That could be the case.,mp3.aiml
0,DOES HYDROGEN CONTAIN A P ORBITAL,*,*,I am uncertain.,mp3.aiml
0,DOES CRUDE COME FROM DEAD PLANTS,*,*,Usually.,mp3.aiml
0,DOES DNA CONTAIN DIOXIDE NUCLIC ACIDS,*,*,Mostly.,mp3.aiml
0,DOES MICROSOFT SUPPORT LDAP,*,*,I am uncertain.,mp3.aiml
0,DOES MICROSOFT MAKE GOOD SOFTWARE,*,*,Sometimes.,mp3.aiml
0,DOES RED INDICATE HOT ON A MAP,*,*,Maybe.,mp3.aiml
0,DOES FERMAT TEOREM IS TRUE,*,*,Usually.,mp3.aiml
0,DOES COKE TASTE BETTER THAN PEPSI,*,*,That's feasible.,mp3.aiml
0,DOES 101 IN BINARY EQUAL 5 IN BASE 10,*,*,Always.,mp3.aiml
0,DOES YANNI PLAY THE TRUMPET,*,*,Possibly.,mp3.aiml
0,DOES JOHN HOLMES HAVE A BIG DICK,*,*,Possibly.,mp3.aiml
0,DOES LINUX PERFORMS BETTER THAN WINDOWS,*,*,Highly likely.,mp3.aiml
0,DOES LINUX RULE,*,*,Possibly.,mp3.aiml
0,DOES JIM CURTIS OWN A DIGITAL CAMERA,*,*,I am uncertain.,mp3.aiml
0,DOES ONLINE MARKETING WORK,*,*,Always.,mp3.aiml
0,DOES CONSCIOUSNESS RISE OUT OF MATTER,*,*,Sometimes.,mp3.aiml
0,DOES CONSCIOUSNESS HAVE ANYTHING,*,*,Within the realm of possibility.,mp3.aiml
0,DOES PORNOGRAPHY EXPLOIT WOMEN,*,*,Within the realm of possibility.,mp3.aiml
0,DOES PORNOGRAPHY DEGRADE WOMEN,*,*,I think so.,mp3.aiml
0,DOES ESSEN MEAN FOOD IN GERMAN,*,*,Maybe.,mp3.aiml
0,DOES MOON CONTAIN WATER,*,*,I think so.,mp3.aiml
0,DOES GRAVITY RULE THE UNIVERSE,*,*,Sometimes.,mp3.aiml
0,DOES GRAVITY AFFECT TEMPERATURE,*,*,I am certain.,mp3.aiml
0,DOES GRAVITY AFFECT TIME,*,*,Maybe.,mp3.aiml
0,DOES GRAVITY POINT DOWN,*,*,Possibly.,mp3.aiml
0,DOES GRAVITY HAVE MAGNETIC ATTRIBUTES,*,*,Possibly.,mp3.aiml
0,DOES MADEIRA BELONG TO PORTUGAL,*,*,I am certain.,mp3.aiml
0,DOES ELVIS COSTELLO PLAY GUITAR,*,*,Likely.,mp3.aiml
0,DOES OREGON HAVE A SALES TAX,*,*,Likely.,mp3.aiml
0,DOES SEAL STAND FOR SEA AIR LAND,*,*,Possibly.,mp3.aiml
0,DOES SODA ROT YOUR TEETH,*,*,Mostly.,mp3.aiml
0,DOES ALCOHOL HELP AGAINST STRESS,*,*,That may be true.,mp3.aiml
0,DOES ALCOHOL GET YOU ANEBRIATED,*,*,Highly likely.,mp3.aiml
0,DOES 1 2 EQUAL 3,*,*,Possibly.,mp3.aiml
0,DOES 1 1 EQUAL 2,*,*,That's feasible.,mp3.aiml
0,DOES 1 0 EQUAL INFINITY,*,*,Likely.,mp3.aiml
0,DOES 1 MEGABYTE EQUAL 1 MILLION BYTES,*,*,That's feasible.,mp3.aiml
0,DOES ELECTRICITY HURT,*,*,Mostly.,mp3.aiml
0,DOES BODYBUILDING CAUSE JOINT STIFFNESS,*,*,I think so.,mp3.aiml
0,DOES EATING SPICY FOOD MAKE YOU SWEAT,*,*,Mostly.,mp3.aiml
0,DOES EATING CHOCOLATE MAKE YOU FAT,*,*,Mostly.,mp3.aiml
0,DOES EATING CHOCOLATE CAUSE ACNE,*,*,For all I know.,mp3.aiml
0,DOES BEER COME FROM A KEG,*,*,Always.,mp3.aiml
0,DOES 30 40 EQUAL 70,*,*,Likely.,mp3.aiml
0,DOES NOTHINGNESS EXIST,*,*,For all I know.,mp3.aiml
0,DOES POETRY RHYME SOMETIMES,*,*,I am certain.,mp3.aiml
0,DOES EXCEDRINE CONTAIN CAFFEINE,*,*,That may be true.,mp3.aiml
0,DOES GEORGE BUSH SLAG OFF REPORTERS,*,*,Likely.,mp3.aiml
0,DOES GEORGE BUSH JR.   PROFANITY,*,*,That may be true.,mp3.aiml
0,DOES CO2 BOND WITH N2,*,*,I am uncertain.,mp3.aiml
0,DOES CAPE COD HAVE GREAT BEACHES,*,*,Always.,mp3.aiml
0,DOES LINKSYS MAKE COFFEE CUPS,*,*,Possibly.,mp3.aiml
0,DOES LINKSYS MAKE NETWORKING PRODUCTS,*,*,Within the realm of possibility.,mp3.aiml
0,DOES LIQUID COMPRESS,*,*,Maybe.,mp3.aiml
0,DOES HENRY KISSENGER SPANK HIS MONKEY,*,*,For all I know.,mp3.aiml
0,DOES WOOD SWIM IN WATER,*,*,Likely.,mp3.aiml
0,DOES WOOD SWIM ON WATER,*,*,That's feasible.,mp3.aiml
0,DOES SUSHI TASTE NICE,*,*,Within the realm of possibility.,mp3.aiml
0,DOES SUSHI TASTE WONDERFUL,*,*,That's feasible.,mp3.aiml
0,DOES CUBAN MUSIC MAKE THE HEART SWELL,*,*,I am uncertain.,mp3.aiml
0,DOES BOB DOLE HAVE ERECTILE DYSFUNCTION,*,*,I think so.,mp3.aiml
0,DOES DELI SLICED MEAN THIN,*,*,That's feasible.,mp3.aiml
0,DOES DAVE MATTHEWS SING,*,*,Likely.,mp3.aiml
0,DOES BULLSHIT BAFFLE BRAINS,*,*,Highly likely.,mp3.aiml
0,DOES GINGER HAVE A MEDICINAL VALUE,*,*,Likely.,mp3.aiml
0,DOES NORA ROBERTS WRITE FICTION,*,*,Mostly.,mp3.aiml
0,DOES PGP STANDS FOR GOOD PRIVACY,*,*,Highly likely.,mp3.aiml
0,DOES COGNITION IMPLY EXISTENCE,*,*,For all I know.,mp3.aiml
0,DOES NATURE ABHOR A VACUUM,*,*,Highly likely.,mp3.aiml
0,DOES NATURE BAT LAST,*,*,Sometimes.,mp3.aiml
0,DOES INTELLIGENCE GROW WITH EXPERIENCE,*,*,I am certain.,mp3.aiml
0,DOES INTELLIGENCE INCLUDE EMOTION,*,*,That could be the case.,mp3.aiml
0,DOES GUM STICK TO GLASS,*,*,I am certain.,mp3.aiml
0,DOES ISCOR PRODUCE STEEL,*,*,That's feasible.,mp3.aiml
0,DOES GINGKO BILOBA HELP MEMORY,*,*,Sometimes.,mp3.aiml
0,DOES ROWAN ATKINSON PLAY MR BEAN,*,*,Highly likely.,mp3.aiml
0,DOES 10 10 EQUAL 20,*,*,I am certain.,mp3.aiml
0,DOES LOVE CONQUER ALL,*,*,For all I know.,mp3.aiml
0,DOES LOVE LAST,*,*,Highly likely.,mp3.aiml
0,DOES LOVE MAKE THE WORLD GO AROUND,*,*,Highly likely.,mp3.aiml
0,DOES LOVE HURT,*,*,Highly likely.,mp3.aiml
0,DOES INK COME FROM AN OCTOPUS,*,*,I think so.,mp3.aiml
0,DOES BILL CLINTON STILL SEE OTHER WOMEN,*,*,Mostly.,mp3.aiml
0,DOES BILL CLINTON SMOKES,*,*,That may be true.,mp3.aiml
0,DOES BILL CLINTON HAVE MORALS,*,*,I am uncertain.,mp3.aiml
0,DOES BILL LIVE IN THE WHITE HOUSE,*,*,Always.,mp3.aiml
0,DOES MAGNESIUM WEIGH MORE THAN CARBON,*,*,Highly likely.,mp3.aiml
0,DOES SPOCK HAVE HOT POINTED EARS,*,*,Mostly.,mp3.aiml
0,DOES TIME STOP IN A BLACK HOLE,*,*,Highly likely.,mp3.aiml
0,DOES TIME FLOW LIKE A RIVER,*,*,Mostly.,mp3.aiml
0,DOES TIME FLY,*,*,Likely.,mp3.aiml
0,DOES TIME IS REAL,*,*,Possibly.,mp3.aiml
0,DOES TIME HAVE A BEGINNING,*,*,Sometimes.,mp3.aiml
0,DOES TIME RHYM WITH MINE,*,*,Mostly.,mp3.aiml
0,DOES TIME EQUAL MONEY,*,*,Highly likely.,mp3.aiml
0,DOES TIME EXIST LINERALLY,*,*,Usually.,mp3.aiml
0,DOES TIME PASS,*,*,Highly likely.,mp3.aiml
0,DOES INFIDEL MEAN NON BELIEVER,*,*,Always.,mp3.aiml
0,DOES GNU MEAN GNU IS NOT UNIX,*,*,That could be the case.,mp3.aiml
0,DOES DON RHYME WITH DAWN,*,*,Maybe.,mp3.aiml
0,DOES DEATH LEAD TO CREATION,*,*,Possibly.,mp3.aiml
0,DOES DEATH FRIGHTEN YOU,*,*,Likely.,mp3.aiml
0,DOES SIN EXIST,*,*,Mostly.,mp3.aiml
0,DOES MY BOYFRIEND LOVE ME,*,*,I think so.,mp3.aiml
0,DOES MY CAR HAVE A COMBUSTABLE ENGINE,*,*,Always.,mp3.aiml
0,DOES MY BREATH SMELL,*,*,That's feasible.,mp3.aiml
0,DOES MY WIFE LOVE ME,*,*,Highly likely.,mp3.aiml
0,DOES MY DOG HAVE FLEAS,*,*,Sometimes.,mp3.aiml
0,DOES MY MOM HAS A CHILD,*,*,Always.,mp3.aiml
0,DOES MY ASS STINK,*,*,Always.,mp3.aiml
