0,IS TERRA MORE MEGA,*,*,That may be true.,mp3.aiml
0,IS ANGEL STRAIGHT,*,*,Within the realm of possibility.,mp3.aiml
0,IS ANGEL STRAIT,*,*,Possibly.,mp3.aiml
0,IS PROSTITUTION LEGAL IN NEVADA,*,*,Within the realm of possibility.,mp3.aiml
0,IS PROSTITUTION MORAL,*,*,For all I know.,mp3.aiml
0,IS HATHOR AN EGYPTIAN DEITY,*,*,Possibly.,mp3.aiml
0,IS JEALOUSY A SIN,*,*,Highly likely.,mp3.aiml
0,IS SPACE EMPTY,*,*,For all I know.,mp3.aiml
0,IS SPACE THE FINAL FRONTIER,*,*,Within the realm of possibility.,mp3.aiml
0,IS SPACE ENDLESS,*,*,Mostly.,mp3.aiml
0,IS SPACE A TRUE VACUUM,*,*,That's feasible.,mp3.aiml
0,IS IRELAND PART OF GREAT BRITAIN,*,*,Highly likely.,mp3.aiml
0,IS IRELAND GREEN,*,*,Always.,mp3.aiml
0,IS ANGELINA JOLIE HOT,*,*,Likely.,mp3.aiml
0,IS AMMONIA A BASE,*,*,Highly likely.,mp3.aiml
0,IS HEWLETT PACKARD ACE,*,*,That's feasible.,mp3.aiml
0,IS RUSSIANS ARE GOOD NATION,*,*,Possibly.,mp3.aiml
0,IS THERE REAL CHEESE IN KRAFT DINNER,*,*,For all I know.,mp3.aiml
0,IS THERE GAIN WITHOUT PAIN,*,*,Mostly.,mp3.aiml
0,IS THERE A SUPERIOR BEING OR GOD,*,*,Possibly.,mp3.aiml
0,IS THERE A SUCKER BORN EVERY MINUTE,*,*,Usually.,mp3.aiml
0,IS THERE A CHURCH IN KOHILA,*,*,That could be the case.,mp3.aiml
0,IS THERE A LIMIT TO VELOCITY,*,*,Always.,mp3.aiml
0,IS THERE A SATAN,*,*,Possibly.,mp3.aiml
0,IS THERE A DOER,*,*,That's feasible.,mp3.aiml
0,IS THERE A MEANING TO LIFE,*,*,Always.,mp3.aiml
0,IS THERE A MEANING OF LIFE,*,*,Maybe.,mp3.aiml
0,IS THERE A MEANING OF ILFE,*,*,Sometimes.,mp3.aiml
0,IS THERE A SIN IN LIFE,*,*,Highly likely.,mp3.aiml
0,IS THERE A PENGUIN CALLED TUX,*,*,Sometimes.,mp3.aiml
0,IS THERE A FRIEND IN JESUS,*,*,That could be the case.,mp3.aiml
0,IS THERE A MEASUREMENT FOR EVERYTHING,*,*,For all I know.,mp3.aiml
0,IS THERE A LETHAL DOSAGE FOR WATER,*,*,Highly likely.,mp3.aiml
0,IS THERE A SUPREME BEING,*,*,That may be true.,mp3.aiml
0,IS THERE A RISK FREE INVESTMENT,*,*,For all I know.,mp3.aiml
0,IS THERE A AFTERLIFE,*,*,Usually.,mp3.aiml
0,IS THERE A PLACE CALLED CORRALEJO,*,*,Likely.,mp3.aiml
0,IS THERE A LINK BETWEEN GOD AND MAN,*,*,That could be the case.,mp3.aiml
0,IS THERE A JOB FOR ME IN SILICON VALLEY,*,*,I think so.,mp3.aiml
0,IS THERE A GOD IN HEAVEN,*,*,Always.,mp3.aiml
0,IS THERE A LIFE AFTER DEATH,*,*,Sometimes.,mp3.aiml
0,IS THERE A PURPOSE TO LIFE,*,*,Likely.,mp3.aiml
0,IS THERE A HELL,*,*,Always.,mp3.aiml
0,IS THERE A SENSE OF LIFE,*,*,Highly likely.,mp3.aiml
0,IS THERE A FIFTH DIMENSION,*,*,I am uncertain.,mp3.aiml
0,IS THERE A FREE WILL,*,*,Always.,mp3.aiml
0,IS THERE A RING AROUND URANUS,*,*,That could be the case.,mp3.aiml
0,IS THERE A HEAVEN AND HELL,*,*,That's feasible.,mp3.aiml
0,IS THERE A GOOD REASON FOR THIS SITE,*,*,I am certain.,mp3.aiml
0,IS THERE A METHOD TO THE MADNESS,*,*,That could be the case.,mp3.aiml
0,IS THERE A MERMAID IN COPENHAGEN,*,*,That may be true.,mp3.aiml
0,IS THERE A 4TH OF JULY IN ENGLAND,*,*,Highly likely.,mp3.aiml
0,IS THERE A NEW WORLD ORDER,*,*,I think so.,mp3.aiml
0,IS THERE A POINT TO THIS QUESTION,*,*,Likely.,mp3.aiml
0,IS THERE A POINT TO THIS,*,*,Mostly.,mp3.aiml
0,IS THERE A DENVER PA,*,*,That's feasible.,mp3.aiml
0,IS THERE A WAY TO UNDERSTAND HUMANITY,*,*,Highly likely.,mp3.aiml
0,IS THERE A WAY TO CURE AIDS,*,*,Likely.,mp3.aiml
0,IS THERE AS SENSE OF LIFE,*,*,Highly likely.,mp3.aiml
0,IS THERE MEANING TO LIFE,*,*,Mostly.,mp3.aiml
0,IS THERE MEANING OF LIFE,*,*,For all I know.,mp3.aiml
0,IS THERE GRAVITY IN SPACE,*,*,Likely.,mp3.aiml
0,IS THERE ARE LIFE OUTSIDE OF EARTH,*,*,Always.,mp3.aiml
0,IS THERE ANOTHER WORD FOR SYNONYM,*,*,Within the realm of possibility.,mp3.aiml
0,IS THERE ANOTHER EARTH IN THE UNIVERSE,*,*,For all I know.,mp3.aiml
0,IS THERE SOMETHING OUT THERE,*,*,Always.,mp3.aiml
0,IS THERE HOPE FOR HUMANITY,*,*,Mostly.,mp3.aiml
0,IS THERE HOPE FOR ME,*,*,Always.,mp3.aiml
0,IS THERE INTELIGENCE OUT OF THE EARTH,*,*,Mostly.,mp3.aiml
0,IS THERE NO FOOL LIKE AN OLD FOOL,*,*,Likely.,mp3.aiml
0,IS THERE NO BUSINESS LIKE SHOW BUSINESS,*,*,Within the realm of possibility.,mp3.aiml
0,IS THERE ALWAYS ROOM FOR JELL O,*,*,That's feasible.,mp3.aiml
0,IS THERE ALWAYS A BETTER WAY,*,*,Possibly.,mp3.aiml
0,IS THERE ALWAYS AN END,*,*,I am uncertain.,mp3.aiml
0,IS THERE ALWAYS SMOKE WITH FIRE,*,*,Possibly.,mp3.aiml
0,IS THERE LAND UNDER THE ARCTIC ICE CAP,*,*,Possibly.,mp3.aiml
0,IS THERE ALMOST A CACTUS IN DESERT,*,*,That's feasible.,mp3.aiml
0,IS THERE AFTERLIFE,*,*,Within the realm of possibility.,mp3.aiml
0,IS THERE ELECTRICITY IN THUNDER,*,*,Within the realm of possibility.,mp3.aiml
0,IS THERE NOTHING LIKE A DAME,*,*,That may be true.,mp3.aiml
0,IS THERE GOING TO BE WAR IN ISRAEL,*,*,Always.,mp3.aiml
0,IS THERE GOD IN HEAVEN,*,*,For all I know.,mp3.aiml
0,IS THERE GOD OUT THERE,*,*,Within the realm of possibility.,mp3.aiml
0,IS THERE GOD,*,*,Possibly.,mp3.aiml
0,IS THERE HONOR AMONG THIEVES,*,*,Possibly.,mp3.aiml
0,IS THERE SUCH A THING A HELL,*,*,Maybe.,mp3.aiml
0,IS THERE SUCH A THING,*,*,Possibly.,mp3.aiml
0,IS THERE LIFE ONLY ON EARTH,*,*,Always.,mp3.aiml
0,IS THERE LIFE OUTSIDE EARTH,*,*,Mostly.,mp3.aiml
0,IS THERE LIFE ON DEEP SPACE,*,*,Within the realm of possibility.,mp3.aiml
0,IS THERE LIFE ON OTHER WORLDS,*,*,Mostly.,mp3.aiml
0,IS THERE ANY ALIEN FORM OF LIFE,*,*,I am certain.,mp3.aiml
0,IS THERE ANY POINT,*,*,Likely.,mp3.aiml
0,IS THERE ARTIFICIAL INTELLIGENCE,*,*,Highly likely.,mp3.aiml
0,IS THERE ALIEN LIFE,*,*,Mostly.,mp3.aiml
0,IS THERE ONE GOD,*,*,For all I know.,mp3.aiml
0,IS THERE ANYTHING I CAN DO FOR YOU,*,*,Sometimes.,mp3.aiml
0,IS THERE ANYTHING AFTER DEATH,*,*,That may be true.,mp3.aiml
0,IS THERE CHRISTMAS IN HELL,*,*,For all I know.,mp3.aiml
0,IS THERE AN ISLAND CALLED LESBOS,*,*,Usually.,mp3.aiml
0,IS THERE AN ANSWER TO THIS QUESTION,*,*,Mostly.,mp3.aiml
0,IS THERE AN ANSWER TO THE QUESTION WHY,*,*,I am uncertain.,mp3.aiml
0,IS THERE AN AFTERLIFE,*,*,That may be true.,mp3.aiml
0,IS THERE AN AFTER LIFE,*,*,Highly likely.,mp3.aiml
0,IS THERE AN EVEN PRIME NUMBER,*,*,I think so.,mp3.aiml
0,IS THERE AN OTHER STATE OF MIND,*,*,Mostly.,mp3.aiml
0,IS THERE AN INTERNATIONAL SPACE STATION,*,*,Mostly.,mp3.aiml
0,IS THERE OTHER LIFE IN OUR SOLAR SYSTEM,*,*,That's feasible.,mp3.aiml
0,IS THERE LIGHT AT NIGHT,*,*,That could be the case.,mp3.aiml
0,IS THERE ONLY ONE GOD,*,*,Sometimes.,mp3.aiml
0,IS THERE ONLY ONE EVEN PRIME NUMBER,*,*,Highly likely.,mp3.aiml
0,IS THERE ONLY ONE UNIVERSE,*,*,That may be true.,mp3.aiml
0,IS THERE MORE THAN ONE UNIVERSE,*,*,I am uncertain.,mp3.aiml
0,IS THERE LIVE IN SPACE,*,*,I think so.,mp3.aiml
0,IS THERE WATER ICE ON THE MOON,*,*,I am certain.,mp3.aiml
0,IS THERE WATER ON THE MARS,*,*,I am certain.,mp3.aiml
0,IS THERE WATER ON MARS,*,*,Likely.,mp3.aiml
0,IS THERE BALM IN GILEAD,*,*,I think so.,mp3.aiml
0,IS LOCK HAVEN A COLLEGE,*,*,Within the realm of possibility.,mp3.aiml
0,IS ABRAHAM LINCOLN THE 16TH PRESIDENT,*,*,Within the realm of possibility.,mp3.aiml
0,IS ABRAHAM LINCOLN THE 17TH PRESIDENT,*,*,Sometimes.,mp3.aiml
0,IS IT NICE TO HUMAN,*,*,For all I know.,mp3.aiml
0,IS IT NECESSARY TO SLEEP EVERY NIGHT,*,*,That may be true.,mp3.aiml
0,IS IT AFRICA A COUNTRY,*,*,For all I know.,mp3.aiml
0,IS IT WRONG TO PIRATE SOFTWARE,*,*,Usually.,mp3.aiml
0,IS IT WRONG TO BE CRUEL,*,*,Mostly.,mp3.aiml
0,IS IT WRONG TO KILL A MURDERER,*,*,Maybe.,mp3.aiml
0,IS IT WRONG TO EAT TOO MUCH,*,*,Always.,mp3.aiml
0,IS IT WRONG TO STEP ON ANTS,*,*,Maybe.,mp3.aiml
0,IS IT A SIMPLE PLEASURE TO DEFECATE,*,*,Highly likely.,mp3.aiml
0,IS IT A DAY,*,*,Always.,mp3.aiml
0,IS IT A FRUGAL ACT TO CLIP COUPONS,*,*,Possibly.,mp3.aiml
0,IS IT A CRIME TO TAKE PENCILS FROM WORK,*,*,I am certain.,mp3.aiml
0,IS IT A GOOD MORNING,*,*,Within the realm of possibility.,mp3.aiml
0,IS IT A GOOD THING TO EXECUTE MURDERERS,*,*,Highly likely.,mp3.aiml
0,IS IT WICKED NOT TO CARE,*,*,Highly likely.,mp3.aiml
0,IS IT ALRIGHT TO USE CURSE WORDS,*,*,Sometimes.,mp3.aiml
0,IS IT AFTER 3 P M IN CALIFORNIA,*,*,I am uncertain.,mp3.aiml
0,IS IT EASY TO FALL IN LOVE,*,*,Mostly.,mp3.aiml
0,IS IT EASY TO WRITE AND READ,*,*,Likely.,mp3.aiml
0,IS IT EASY TO BE HAPPY,*,*,Conceivably.,mp3.aiml
0,IS IT EASY TO KILL OTHER PEOPLE,*,*,For all I know.,mp3.aiml
0,IS IT OK IF I TOUCH MYSELF,*,*,Within the realm of possibility.,mp3.aiml
0,IS IT OK TO RUN A YELLOW LIGHT,*,*,Possibly.,mp3.aiml
0,IS IT SAFE TO VISIT INDIA,*,*,Mostly.,mp3.aiml
0,IS IT SAFE TO DRIVE,*,*,Likely.,mp3.aiml
0,IS IT SAFE WHEN THE LIGHTS ARE OUT,*,*,I think so.,mp3.aiml
0,IS IT POSSIBLE THAT LIFE IS A DREAM,*,*,Likely.,mp3.aiml
0,IS IT POSSIBLE FOR IRON TO BURN,*,*,Always.,mp3.aiml
0,IS IT POSSIBLE FOR IT TO RAIN FROGS,*,*,Within the realm of possibility.,mp3.aiml
0,IS IT POSSIBLE FOR A COMPUTER TO THINK,*,*,Usually.,mp3.aiml
0,IS IT BLUE BLUE,*,*,Within the realm of possibility.,mp3.aiml
0,IS IT COOL TO WEAR GLASSES,*,*,Sometimes.,mp3.aiml
0,IS IT COOL TO LIVE IN FRANCE,*,*,Maybe.,mp3.aiml
0,IS IT LILLE IN FRANCE,*,*,Highly likely.,mp3.aiml
0,IS IT SUMMER IN THE USA,*,*,Maybe.,mp3.aiml
0,IS IT SUMMER,*,*,Sometimes.,mp3.aiml
0,IS IT DAYTIME,*,*,Within the realm of possibility.,mp3.aiml
0,IS IT BETTER TO BE THIN,*,*,Usually.,mp3.aiml
0,IS IT BETTER TO BE INTELLIGENT OF DUMB,*,*,Likely.,mp3.aiml
0,IS IT BETTER TO BE YOUNG THAN TO BE OLD,*,*,Possibly.,mp3.aiml
0,IS IT BETTER TO GO NAKED IN THE SUMMER,*,*,I think so.,mp3.aiml
0,IS IT DIFFICULT TO SILENCE A REVOLVER,*,*,That may be true.,mp3.aiml
0,IS IT DIFFICULT TO LIVE,*,*,Likely.,mp3.aiml
0,IS IT ALWAYS DARKEST BEFORE THE DAWN,*,*,Within the realm of possibility.,mp3.aiml
0,IS IT ALWAYS WRONG TO KILL PEOPLE,*,*,That may be true.,mp3.aiml
0,IS IT ALWAYS COLD WHEN IT RAINS,*,*,Possibly.,mp3.aiml
0,IS IT ALWAYS DARK AT NIGHT,*,*,For all I know.,mp3.aiml
0,IS IT SO EASY TO FALL IN LOVE,*,*,Likely.,mp3.aiml
0,IS IT RAINING IN LONDON,*,*,I think so.,mp3.aiml
0,IS IT RUDE TO KISS STRANGERS,*,*,Always.,mp3.aiml
0,IS IT ETHICAL TO SQUEEZE THE CHARMIN,*,*,Possibly.,mp3.aiml
0,IS IT CHILLY OUTSIDE,*,*,Highly likely.,mp3.aiml
0,IS IT IN HUMAN NATURE TO BE DESTRUCTIVE,*,*,Possibly.,mp3.aiml
0,IS IT TIME I GOT BACK TO WORK,*,*,Highly likely.,mp3.aiml
0,IS IT STUPID TO BARK BACK AT DOGS,*,*,Highly likely.,mp3.aiml
0,IS IT UNHEALTHY TO EAT PROCESSED MEAT,*,*,That's feasible.,mp3.aiml
0,IS IT BAD LUCK TO KICK A DOG,*,*,Maybe.,mp3.aiml
0,IS IT BAD LUCK TO WALK UNDER A LADDER,*,*,For all I know.,mp3.aiml
0,IS IT IMMORAL TO HAVE TWO WIVES,*,*,Sometimes.,mp3.aiml
0,IS IT DRY INSIDE,*,*,Mostly.,mp3.aiml
0,IS IT LEGAL TO BREAST FEED IN PUBLIC,*,*,Mostly.,mp3.aiml
0,IS IT DANGEROUS TO DRIVE A CAR,*,*,Always.,mp3.aiml
0,IS IT OKAY TO HAVE SEX WITH FRIENDS,*,*,Maybe.,mp3.aiml
0,IS IT OKAY TO WANK,*,*,Highly likely.,mp3.aiml
0,IS IT NORMAL TO MASTURBATE EVERY DAY,*,*,I am uncertain.,mp3.aiml
0,IS IT NORMAL TO BE A HOMOSEXUAL,*,*,For all I know.,mp3.aiml
0,IS IT FUNNY TO ASK ALICE QUESTIONS,*,*,That may be true.,mp3.aiml
0,IS IT FUNNY WHEN A MIME APPEARS,*,*,That's feasible.,mp3.aiml
0,IS IT IMPERATIVE TO QUESTION EVERYTHING,*,*,For all I know.,mp3.aiml
0,IS IT ABBIATEGRASSO A TOWN NEAR MILAN,*,*,Likely.,mp3.aiml
0,IS IT RATIONAL TO TRUST YOUR NEIGHBOR,*,*,I think so.,mp3.aiml
0,IS IT GOOD TO BE OUT,*,*,I am certain.,mp3.aiml
0,IS IT GOOD TO DIE,*,*,Highly likely.,mp3.aiml
0,IS IT GOOD TO THINK WELL OF ONESELF,*,*,Highly likely.,mp3.aiml
0,IS IT GOOD TO LIVE IN GERMANY,*,*,Always.,mp3.aiml
0,IS IT NATURAL TO BE GAY,*,*,Sometimes.,mp3.aiml
0,IS IT SOMETIMES GOOD TO FEEL SAD,*,*,Likely.,mp3.aiml
0,IS IT HARD TO UNDERSTAND OTHER PEOPLE,*,*,Mostly.,mp3.aiml
0,IS IT RIGHT TO LIE SOMETIMES,*,*,Likely.,mp3.aiml
0,IS IT RIGHT TO BE GAY,*,*,Possibly.,mp3.aiml
0,IS IT RIGHT TO KILL AN ANIMAL,*,*,That's feasible.,mp3.aiml
0,IS IT RARE TO FIND SEALS IN PANGEA,*,*,Sometimes.,mp3.aiml
0,IS IT TRUE WHAT I READ IN THE NEWSPAPER,*,*,Likely.,mp3.aiml
0,IS IT TRUE THAT TIME HEALS ALL WOUNDS,*,*,That could be the case.,mp3.aiml
0,IS IT TRUE THAT EVERYTHING HAS A PRICE,*,*,Sometimes.,mp3.aiml
0,IS IT TRUE THAT LOVE CONQUERS ALL,*,*,Sometimes.,mp3.aiml
0,IS IT TRUE THAT DRUGS ARE BAD,*,*,Within the realm of possibility.,mp3.aiml
0,IS IT TRUE THAT HOMO HOMINI LUPUS EST,*,*,Maybe.,mp3.aiml
0,IS IT DARKEST BEFORE THE DAWN,*,*,That's feasible.,mp3.aiml
0,IS IT MORE FUN TO COMPUTE,*,*,I think so.,mp3.aiml
0,IS IT SAUDADE A PORTUGUESE WORD,*,*,That's feasible.,mp3.aiml
0,IS IT PREFERABLE TO BE SLIM,*,*,Highly likely.,mp3.aiml
0,IS AKIRA A CLASSIC ANIME FILM,*,*,Within the realm of possibility.,mp3.aiml
0,IS YLANG YLANG A FRAGRANCE,*,*,I am uncertain.,mp3.aiml
0,IS DISPOSABLE TUPPERWARE A GREAT IDEA,*,*,For all I know.,mp3.aiml
0,IS HELSINKI CAPITOL OF SWEDEN,*,*,Highly likely.,mp3.aiml
0,IS MODERN ART CONSIDERED FINE ART,*,*,That may be true.,mp3.aiml
0,IS KRI KRI AN ISLAND,*,*,That's feasible.,mp3.aiml
0,IS GERMAN AN INDOEUROPEAN LANGUAGE,*,*,Highly likely.,mp3.aiml
0,IS VIRGINIA SOUTH OF MAINE,*,*,Always.,mp3.aiml
0,IS QUERELLING NATURAL FOR HUMAN BEING,*,*,Mostly.,mp3.aiml
0,IS ANDORA A INDEPENDENT STATE,*,*,For all I know.,mp3.aiml
0,IS AD,*,*,That could be the case.,mp3.aiml
0,IS LOGGING ON PUBLIC LANDS WRONG,*,*,Always.,mp3.aiml
0,IS PORNOGRAPHY ADDICTIVE,*,*,That could be the case.,mp3.aiml
0,IS TOO MUCH JOGGING BAD FOR YOUR HEALTH,*,*,Highly likely.,mp3.aiml
0,IS TOO MUCH ENOUGH,*,*,Within the realm of possibility.,mp3.aiml
0,IS TOO MUCH DEBT BAD FOR YOUR CREDIT,*,*,I am certain.,mp3.aiml
0,IS OSWEGO A COUNTY IN MARYLAND,*,*,Maybe.,mp3.aiml
0,IS INTERSTELLAR TRAVEL POSSIBLE,*,*,That may be true.,mp3.aiml
0,IS JOHN WOO TALENTED,*,*,For all I know.,mp3.aiml
0,IS JOHN DONNE DEAD,*,*,That could be the case.,mp3.aiml
0,IS JOHN LEE HOOKER BLIND,*,*,That's feasible.,mp3.aiml
0,IS JOHN FOWLES AN ENGLISH WRITER,*,*,Usually.,mp3.aiml
0,IS JOHN HOMES DEAD,*,*,Within the realm of possibility.,mp3.aiml
0,IS JOHN HOLMES A FAMOUS PORN ACTOR,*,*,Sometimes.,mp3.aiml
0,IS JOHN STEINBECK A GOOD WRITER,*,*,Always.,mp3.aiml
0,IS O J SIMPSON A MURDERER,*,*,Mostly.,mp3.aiml
0,IS ABN AMRO A NAME OF A BANK,*,*,That's feasible.,mp3.aiml
0,IS BARBARA CARRERA A PORN STAR,*,*,I am uncertain.,mp3.aiml
0,IS MISNIGHT THE OPPOSITE OF NOON,*,*,Maybe.,mp3.aiml
0,IS LAGOS THE CAPITAL OF NIGERIA,*,*,Always.,mp3.aiml
0,IS LAGOS A NIGERIAN PORT,*,*,Mostly.,mp3.aiml
0,IS ARES A GREEK DEMIGOD OF WAR,*,*,Likely.,mp3.aiml
0,IS PERL A GOOD PROGRAMMING LANGUAGE,*,*,Likely.,mp3.aiml
0,IS KLAUS KINSKI AN ACTOR,*,*,Mostly.,mp3.aiml
0,IS VIOLET A TYPE OF BLUE,*,*,I think so.,mp3.aiml
0,IS SUICIDE AN ACT OF COWARDICE,*,*,I think so.,mp3.aiml
0,IS SUICIDE ILLEGAL,*,*,Highly likely.,mp3.aiml
0,IS NET INCOME REVENUE PLUS EXPENSES,*,*,Highly likely.,mp3.aiml
0,IS FORD PREFECT A HOOPY FROOD,*,*,Possibly.,mp3.aiml
0,IS WAR ALLWAYS BAD,*,*,Likely.,mp3.aiml
0,IS WAR STATE SPONSORED MURDER,*,*,Maybe.,mp3.aiml
0,IS WAR A NESSISARY EVIL,*,*,I am uncertain.,mp3.aiml
0,IS WAR ALWAYS A BAD THING,*,*,Likely.,mp3.aiml
0,IS RED HOT COLOR,*,*,I am certain.,mp3.aiml
0,IS RED THE FIRST COLOR OF THE RAINBOW,*,*,That may be true.,mp3.aiml
0,IS RED THE BEST COLOR FOR A FIRE TRUCK,*,*,I think so.,mp3.aiml
0,IS RED HAIR THICKER THAN BLONDE HAIR,*,*,Maybe.,mp3.aiml
0,IS RED LIGHT HOTTER THAN BLUE LIGHT,*,*,Possibly.,mp3.aiml
0,IS RED TIDE TOXIC,*,*,That may be true.,mp3.aiml
0,IS RED TIDE CAUSED BY ALGEA,*,*,Always.,mp3.aiml
0,IS RED ALDER A HARDER WOOD THAN RED OAK,*,*,Possibly.,mp3.aiml
0,IS HELGOLAND AN ISLAND IN THE NORTH SEA,*,*,That could be the case.,mp3.aiml
0,IS SOFT ROCK COOL,*,*,I am certain.,mp3.aiml
0,IS CREATING ALICE A WONDERFUL IDEA,*,*,I am certain.,mp3.aiml
0,IS SCOOBY DOO CAPABLE OF SPEECH,*,*,Within the realm of possibility.,mp3.aiml
0,IS CHICKEN WHITE MEAT,*,*,That could be the case.,mp3.aiml
0,IS HONG KONG A TROPICAL LOCATION,*,*,That could be the case.,mp3.aiml
0,IS PENIS SIZE IMPORTANT TO WOMEN,*,*,Always.,mp3.aiml
0,IS PENIS SIZE IMPORTANT,*,*,Possibly.,mp3.aiml
0,IS PENIS LENGTH IMPORTANT,*,*,Maybe.,mp3.aiml
0,IS OLYMPIA THE CAPITOL OF WASHINGTON,*,*,Within the realm of possibility.,mp3.aiml
0,IS DIRECTX A 3D PLATFORM,*,*,Always.,mp3.aiml
0,IS KRYPTON AN ELEMENT,*,*,That may be true.,mp3.aiml
0,IS SODIUM AN ACTIVE METAL,*,*,Sometimes.,mp3.aiml
0,IS CONTINUITY AN IDEA,*,*,I am certain.,mp3.aiml
0,IS DREAMING AS IMPORTANT AS WAKING LIFE,*,*,Highly likely.,mp3.aiml
0,IS MONOGAMY THAT IMPORTANT,*,*,That may be true.,mp3.aiml
0,IS MONOGAMY NATURAL FOR HUMANS,*,*,For all I know.,mp3.aiml
0,IS MONOGAMY NATURAL,*,*,Possibly.,mp3.aiml
0,IS MONOGAMY MORALLY CORRECT,*,*,Sometimes.,mp3.aiml
0,IS IMPLORE THE SAME AS BEG,*,*,That may be true.,mp3.aiml
0,IS COLOMBO THE CAPITAL OF SRILANKA,*,*,Likely.,mp3.aiml
0,IS WARFARIN USED AS RAT POISON,*,*,Within the realm of possibility.,mp3.aiml
0,IS NORFOLK IN VIRGINIA,*,*,Highly likely.,mp3.aiml
0,IS COFFEE HEALTHY FOR HUMANS TO DRINK,*,*,Possibly.,mp3.aiml
0,IS COFFEE A DRUG,*,*,Highly likely.,mp3.aiml
0,IS COFFEE A GOOD THING,*,*,I am certain.,mp3.aiml
0,IS COFFEE BAD FOR HEALTH,*,*,Possibly.,mp3.aiml
0,IS EXISTANCE FINITE,*,*,Likely.,mp3.aiml
0,IS BJARNE STROUSTRUP AN AUTHOR,*,*,Within the realm of possibility.,mp3.aiml
0,IS TULSA A CITY IN OKLAHOMA,*,*,That may be true.,mp3.aiml
0,IS SKA GOOD FOR THE EARS,*,*,Highly likely.,mp3.aiml
0,IS 14 AIML BAK MINDPIXELS DAT MINDPIXELS TXT MP CL MP FASL ONESHOT TALK VERSIONS 23 GREATER THAN 13 AIML BAK MINDPIXELS DAT MINDPIXELS TXT MP CL MP FASL ONESHOT TALK VERSIONS 24,*,*,Always.,mp3.aiml
0,IS 14 SOONER THAN 97,*,*,Sometimes.,mp3.aiml
0,IS I EQUAL E R,*,*,Possibly.,mp3.aiml
0,IS SORRY EVER ENOUGH,*,*,That may be true.,mp3.aiml
0,IS FIDUCIARY A BIG WORD LIKE SPAGHETTI,*,*,Maybe.,mp3.aiml
0,IS MCI A LOCAL TELEPHONE SERVICE,*,*,I am uncertain.,mp3.aiml
0,IS CYBERPUNK STILL ALIVE,*,*,That may be true.,mp3.aiml
0,IS BURPING FUN,*,*,Within the realm of possibility.,mp3.aiml
0,IS BLACK THE SYMBOL OF EVIL,*,*,Sometimes.,mp3.aiml
0,IS BLACK THE ABSENCE OF LIGHT,*,*,I am certain.,mp3.aiml
0,IS BLACK THE ABSENCE OF ALL COLOR,*,*,Mostly.,mp3.aiml
0,IS BLACK THE ABSENSE OF COLOR,*,*,Mostly.,mp3.aiml
0,IS BLACK A SHADE,*,*,Sometimes.,mp3.aiml
0,IS BLACK A NEUTRAL COLOR,*,*,That may be true.,mp3.aiml
0,IS BLACK A NATURAL PIGMENT,*,*,Mostly.,mp3.aiml
0,IS VERTIGO THE FEAR OF HEIGHT,*,*,Maybe.,mp3.aiml
0,IS TALK CHEAP,*,*,Usually.,mp3.aiml
0,IS LANCE ARMSTRONG A GOOD CYCLIST,*,*,I think so.,mp3.aiml
0,IS BCENTRAL A MICROSOFT SERVICE,*,*,Possibly.,mp3.aiml
0,IS SEEING BELEIVING,*,*,Within the realm of possibility.,mp3.aiml
0,IS SOAP THE SALT OF A FATTY ACID,*,*,I think so.,mp3.aiml
0,IS PHP3 A GOOD SCRIPTING LANGUAGE,*,*,Sometimes.,mp3.aiml
0,IS CHEASE A DARY PRODUCT,*,*,I think so.,mp3.aiml
0,IS GALLAGER FUNNY,*,*,That's feasible.,mp3.aiml
0,IS ENVIROMENTALISM OVERRATED,*,*,Possibly.,mp3.aiml
0,IS HEAVY METAL BORING,*,*,For all I know.,mp3.aiml
0,IS HEAVY WATER A RADIOACTIVE SUBSTANCE,*,*,That's feasible.,mp3.aiml
0,IS HAWKING A SCIENTIST,*,*,Mostly.,mp3.aiml
0,IS GEEZER SLANG FOR OLD PERSON,*,*,Always.,mp3.aiml
0,IS CENTRALE AN ENGINEERS SCHOOL,*,*,Possibly.,mp3.aiml
0,IS TIRANA THE CAPITAL OF ALBANIA,*,*,Conceivably.,mp3.aiml
0,IS REMOVING COPYRIGHT A CRIMINAL ACT,*,*,Maybe.,mp3.aiml
0,IS WEEZER A ROCKBAND,*,*,Usually.,mp3.aiml
0,IS KEANU REEVES A STUPID DORK,*,*,For all I know.,mp3.aiml
0,IS LESS SOMETIMES MORE,*,*,Possibly.,mp3.aiml
0,IS BURLINGTON THE CAPITAL OF VERMONT,*,*,I think so.,mp3.aiml
0,IS INTELLIGENCE A COMMODITY,*,*,Sometimes.,mp3.aiml
0,IS INTELLIGENCE INHERITED,*,*,Likely.,mp3.aiml
0,IS INTELLIGENCE ESSENTIAL,*,*,Mostly.,mp3.aiml
0,IS PAPER USED FOR CAT LITTER,*,*,That's feasible.,mp3.aiml
0,IS MILITARY INTELLIGENCE AN OXYMORON,*,*,That's feasible.,mp3.aiml
0,IS TURKEY A DEMOCRACY,*,*,Possibly.,mp3.aiml
0,IS NORTH MOUNTAIN PARK IN PHOENIX,*,*,I think so.,mp3.aiml
0,IS PLASTIC HARD,*,*,Always.,mp3.aiml
0,IS SUGAR MAPLE HARD WOOD,*,*,That may be true.,mp3.aiml
0,IS MARBLE A METAMORPHIC ROCK,*,*,That may be true.,mp3.aiml
0,IS CONSTIPATION IN OTHERS FUNNY,*,*,For all I know.,mp3.aiml
0,IS MOJO GOOD FOR YOU,*,*,Highly likely.,mp3.aiml
0,IS BARRY WHITE OVERWEIGHT,*,*,I am certain.,mp3.aiml
0,IS GLUTTONY A SECRET VICE,*,*,That may be true.,mp3.aiml
0,IS FORTH A COMPUTER LANGUAGE,*,*,That may be true.,mp3.aiml
0,IS MONEY THE ROOT OF ALL EVIL,*,*,That's feasible.,mp3.aiml
0,IS MONEY A LIMITED RESOURCE,*,*,That could be the case.,mp3.aiml
0,IS MONEY NECESSARY FOR COMMERCE,*,*,I think so.,mp3.aiml
0,IS MONEY NECESSARY,*,*,Sometimes.,mp3.aiml
0,IS MONEY IMPORTANT FOR HAPPINESS,*,*,Maybe.,mp3.aiml
0,IS MONEY EVERYTHING,*,*,Possibly.,mp3.aiml
0,IS MONEY GREEN,*,*,Highly likely.,mp3.aiml
0,IS GSM A BEST MOBILE STANDART,*,*,For all I know.,mp3.aiml
0,IS CO2 DANGEROUS,*,*,I think so.,mp3.aiml
0,IS NINEVAH THE CAPITAL OF ASSYRIA,*,*,Highly likely.,mp3.aiml
0,IS COMPUTING HARD TO LEARN,*,*,For all I know.,mp3.aiml
0,IS BRANDENBURG A STATE IN GERMANY,*,*,Likely.,mp3.aiml
0,IS CHE GUEVARA A CUBAN,*,*,Within the realm of possibility.,mp3.aiml
0,IS C A GOOD PROGRAMMING LANGUAGE,*,*,Possibly.,mp3.aiml
0,IS C A SUBSET OF C,*,*,Possibly.,mp3.aiml
0,IS C A WONDERFUL PROGRAMMING LANGUAGE,*,*,Highly likely.,mp3.aiml
0,IS C AN OOP LANGUAGE,*,*,Maybe.,mp3.aiml
0,IS NGC SHORT FOR NEW GENERAL CATALOG,*,*,For all I know.,mp3.aiml
0,IS DRIVING A CAR EASY TO DO,*,*,That may be true.,mp3.aiml
0,IS ZEN A RELIGION,*,*,Highly likely.,mp3.aiml
0,IS ZEN MEDITATION HAPPY,*,*,Likely.,mp3.aiml
0,IS APPLIE A FRUIT,*,*,Likely.,mp3.aiml
0,IS YUGOSLAVIA A DEMOCRACY,*,*,Within the realm of possibility.,mp3.aiml
0,IS YUGOSLAVIA A FREE COUNTRY,*,*,Possibly.,mp3.aiml
0,IS APPLE PIE AMERICAN,*,*,That may be true.,mp3.aiml
0,IS URANIUM ELEMENT 82,*,*,I think so.,mp3.aiml
0,IS NOTHING THAT WHICH IS AND IS NOT,*,*,I think so.,mp3.aiml
0,IS NOTHING SOMETHING,*,*,I am uncertain.,mp3.aiml
0,IS URBAN LEGEND O FILM,*,*,Possibly.,mp3.aiml
0,IS OPRAH FAT,*,*,That may be true.,mp3.aiml
0,IS ANAL SEX REPULSIVE,*,*,Highly likely.,mp3.aiml
0,IS ANAL SEX PAINFUL,*,*,I am certain.,mp3.aiml
0,IS ANAL SEX IS PAINFUL,*,*,I think so.,mp3.aiml
0,IS ANAL SEX PLEASURABLE FOR MEN,*,*,That's feasible.,mp3.aiml
0,IS ANAL SEX PLEASURABLE TO A WOMAN,*,*,For all I know.,mp3.aiml
0,IS ANAL SEX ENJOYABLE,*,*,Maybe.,mp3.aiml
0,IS ASPHALT MADE FROM PETROLEUM,*,*,Always.,mp3.aiml
0,IS FLURINE HEAVER THEN OXYGEN,*,*,Highly likely.,mp3.aiml
0,IS JUPITER THE 7TH PLANET FROM THE SUN,*,*,For all I know.,mp3.aiml
0,IS AIR PRIMARILY NITROGEN,*,*,Highly likely.,mp3.aiml
0,IS AIR MADE UP MOSTLY FROM NITROGEN,*,*,Highly likely.,mp3.aiml
0,IS AIR NECESSARY FOR LIFE,*,*,I think so.,mp3.aiml
0,IS PARIS A TOWN IN TEXAS,*,*,Within the realm of possibility.,mp3.aiml
0,IS MARIS COOL,*,*,Possibly.,mp3.aiml
0,IS PREDESTINATION A VALID CONCEPT,*,*,For all I know.,mp3.aiml
0,IS DJ KEOKI A TECHNO ARTIST,*,*,Mostly.,mp3.aiml
0,IS SCUBA CERTIFICATION HARD TO GET,*,*,Possibly.,mp3.aiml
0,IS POLITICS A FORM OF ORGANISED CRIME,*,*,I am uncertain.,mp3.aiml
0,IS TRUTH ABSOLUTE,*,*,Possibly.,mp3.aiml
0,IS TRUTH UNIVERSAL,*,*,Usually.,mp3.aiml
0,IS TRUTH NEITHER RELATIVE OR ABSOLUTE,*,*,I think so.,mp3.aiml
0,IS TRUTH NEITHER RELATIVE NOR ABSOLUTE,*,*,That's feasible.,mp3.aiml
0,IS TRUTH STRANGER THAN FICTION,*,*,Always.,mp3.aiml
0,IS TRUTH SOMEONES INTERPRETATION,*,*,Highly likely.,mp3.aiml
0,IS TRUTH BEAUTY AND BEAUTY TRUTH,*,*,Within the realm of possibility.,mp3.aiml
0,IS TRUTH BEAUTY,*,*,Likely.,mp3.aiml
0,IS TRUTH RELATIVE,*,*,Mostly.,mp3.aiml
0,IS TRUTH ALWAYS TRUTHFUL,*,*,That may be true.,mp3.aiml
0,IS TRUTH BETTER THAN HAPPINES,*,*,Conceivably.,mp3.aiml
0,IS BEING GAY OKAY,*,*,Always.,mp3.aiml
0,IS BEING GAY UNATURAL,*,*,I am uncertain.,mp3.aiml
0,IS BEING A PIMP ILLEGAL,*,*,Always.,mp3.aiml
0,IS BEING A POT HEAD BAD,*,*,I am certain.,mp3.aiml
0,IS BEING GOOD FUN,*,*,Always.,mp3.aiml
0,IS MASTURBATION A HEALTHY PRACTISE,*,*,That could be the case.,mp3.aiml
0,IS MASTURBATION GOOD,*,*,Always.,mp3.aiml
0,IS JAVA SIMILAR TO C,*,*,Sometimes.,mp3.aiml
0,IS JAVA A TYPE OF COFFEE BEAN,*,*,I am uncertain.,mp3.aiml
0,IS JAVA PLATFORM INDEPENDANT,*,*,Within the realm of possibility.,mp3.aiml
0,IS JAVA LANGUAGE,*,*,Possibly.,mp3.aiml
0,IS JAVA AN ISLAND IN THE SOUTH PACIFIC,*,*,Mostly.,mp3.aiml
0,IS JAVA AN INTERPRETED LANGUAGE,*,*,I am certain.,mp3.aiml
0,IS TALLAHASSEE THE CAPITOL OF FLORIDA,*,*,I think so.,mp3.aiml
0,IS GUERNSEY ONE OF THE CHANNEL ISLANDS,*,*,Sometimes.,mp3.aiml
0,IS BC A UNIX CALCULATOR,*,*,Possibly.,mp3.aiml
0,IS NACL SALT,*,*,I am certain.,mp3.aiml
0,IS DEUTERIUM AN ISOTOPE OF HYDROGEN,*,*,Mostly.,mp3.aiml
0,IS AMY RAY AN INDIGO GIRL,*,*,Possibly.,mp3.aiml
0,IS WINAMP THE BEST MP3 PLAYER,*,*,I am uncertain.,mp3.aiml
0,IS TERIAKY BROWN,*,*,Mostly.,mp3.aiml
0,IS MICHIGAN GOOD,*,*,For all I know.,mp3.aiml
0,IS HUMAN SKIN CONSIDERED TO BE AN ORGAN,*,*,Usually.,mp3.aiml
0,IS HUMAN BEAUTIFUL,*,*,Likely.,mp3.aiml
0,IS HUMAN BEING TO TAKE A COLD,*,*,That could be the case.,mp3.aiml
0,IS HUMAN NATURE FUNDMENTALLY GOOD,*,*,Highly likely.,mp3.aiml
0,IS HUMAN KNOWLEDGE LIMITED,*,*,Mostly.,mp3.aiml
0,IS HUMAN,*,*,Highly likely.,mp3.aiml
0,IS KUNG FU A MARTIAL ART FROM CHINA,*,*,Mostly.,mp3.aiml
0,IS FURTHER MATHS HARD,*,*,Possibly.,mp3.aiml
0,IS DARKNESS AN ABSTRACT TERM,*,*,That's feasible.,mp3.aiml
0,IS HROTHGAR A CHARACTER IN BEOWULF,*,*,Mostly.,mp3.aiml
0,IS PRAGUE THE CAPITAL OF SLOVAKIA,*,*,Possibly.,mp3.aiml
0,IS PENN TALLER THAN TELLER,*,*,I am uncertain.,mp3.aiml
0,IS SLASHDOT STUFF THAT MATTERS,*,*,Possibly.,mp3.aiml
0,IS SLASHDOT A GOOD WEBSITE,*,*,Highly likely.,mp3.aiml
0,IS SLASHDOT A WEB SITE FOR NERDS,*,*,Always.,mp3.aiml
0,IS SLASHDOT AN ONLINE NEWS WEBSITE,*,*,Always.,mp3.aiml
0,IS ICE CUBE A BROTHA,*,*,That may be true.,mp3.aiml
0,IS ICE CREAM A DESERT,*,*,Mostly.,mp3.aiml
0,IS ICE CLIMBING POPULAR IN COLORADO,*,*,Usually.,mp3.aiml
0,IS ICE WATER COOLED TO 0 DEGREE C,*,*,Possibly.,mp3.aiml
0,IS MICKEY MOUSE AN ANIMAL,*,*,Within the realm of possibility.,mp3.aiml
0,IS TORI AMOS A PIANIST,*,*,I think so.,mp3.aiml
0,IS EMERSON COLLEGE IN BOSTON MA,*,*,Maybe.,mp3.aiml
0,IS MELTED SAND THE SAME AS GLASS,*,*,I think so.,mp3.aiml
